label,text,message_length,timestamp,cleaned_text
ham,"Thank you so much. When we skyped wit kz and sura, we didnt get the pleasure of your company. Hope you are good. We've given you ultimatum oh! We are countin down to aburo. Enjoy!",179,2023-02-22 13:00:00,thank much skyped wit kz sura didnt get pleasure company hope good weve given ultimatum oh countin aburo enjoy
spam,"Hungry gay guys feeling hungry and up 4 it, now. Call 08718730555 just 10p/min. To stop texts call 08712460324 (10p/min)",120,2023-02-22 14:00:00,hungry gay guy feeling hungry call pmin stop text call pmin
ham,Ok. No wahala. Just remember that a friend in need ...,54,2023-02-22 15:00:00,ok wahala remember friend need
ham,I will see in half an hour,26,2023-02-22 16:00:00,see half hour
ham,"Im in inperialmusic listening2the weirdest track ever byåÓleafcutter johnåÓ-sounds like insects being molested&someone plumbing,remixed by evil men on acid!",156,2023-02-22 17:00:00,im inperialmusic listeningthe weirdest track ever byleafcutter johnsounds like insect molestedsomeone plumbingremixed evil men acid
ham,\Hey sorry I didntgive ya a a bellearlier hunny,47,2023-02-22 18:00:00,hey sorry didntgive ya bellearlier hunny
ham,SERIOUSLY. TELL HER THOSE EXACT WORDS RIGHT NOW.,48,2023-02-22 19:00:00,seriously tell exact word right
spam,Can U get 2 phone NOW? I wanna chat 2 set up meet Call me NOW on 09096102316 U can cum here 2moro Luv JANE xx Callså£1/minmoremobsEMSPOBox45PO139WA,147,2023-02-22 20:00:00,u get phone wanna chat set meet call u cum moro luv jane xx callsminmoremobsemspoboxpowa
ham,"Tee hee. Off to lecture, cheery bye bye.",40,2023-02-22 21:00:00,tee hee lecture cheery bye bye
ham,"Sorry chikku, my cell got some problem thts y i was nt able to reply u or msg u..",81,2023-02-22 22:00:00,sorry chikku cell got problem thts nt able reply u msg u
ham,If you still havent collected the dough pls let me know so i can go to the place i sent it to get the control number,116,2023-02-22 23:00:00,still havent collected dough pls let know go place sent get control number
ham,Ok...,5,2023-02-23 00:00:00,ok
spam,network operator. The service is free. For T & C's visit 80488.biz,66,2023-02-23 01:00:00,network operator service free c visit biz
ham,Let me know how to contact you. I've you settled in a room. Lets know you are ok.,81,2023-02-23 02:00:00,let know contact ive settled room let know ok
ham,Wot u up 2 u weirdo?,20,2023-02-23 03:00:00,wot u u weirdo
ham,Can do lor...,13,2023-02-23 04:00:00,lor
ham,Dont put your phone on silent mode ok,37,2023-02-23 05:00:00,dont put phone silent mode ok
ham,Can i meet Ì_ at 5.. As 4 where depends on where Ì_ wan 2 in lor..,66,2023-02-23 06:00:00,meet depends wan lor
ham,Waiting 4 my tv show 2 start lor... U leh still busy doing ur report?,69,2023-02-23 07:00:00,waiting tv show start lor u leh still busy ur report
ham,Oh ho. Is this the first time u use these type of words,55,2023-02-23 08:00:00,oh ho first time u use type word
ham,Am I the only one who doesn't stalk profiles?,45,2023-02-23 09:00:00,one doesnt stalk profile
ham,"Ever green quote ever told by Jerry in cartoon \A Person Who Irritates u Always Is the one Who Loves u Vry Much But Fails to Express It...!..!! :-) :-) gud nyt""",160,2023-02-23 10:00:00,ever green quote ever told jerry cartoon person irritates u always one love u vry much fails express gud nyt
ham,Yes i thought so. Thanks.,25,2023-02-23 11:00:00,yes thought thanks
ham,But if she.s drinkin i'm ok.,28,2023-02-23 12:00:00,shes drinkin im ok
ham,"Just wondering, the others just took off",40,2023-02-23 13:00:00,wondering others took
ham,"Night has ended for another day, morning has come in a special way. May you smile like the sunny rays and leaves your worries at the blue blue bay. Gud mrng",156,2023-02-23 14:00:00,night ended another day morning come special way may smile like sunny ray leaf worry blue blue bay gud mrng
ham,"What do you do, my dog ? Must I always wait till the end of your day to have word from you ? Did you run out of time on your cell already?",138,2023-02-23 15:00:00,dog must always wait till end day word run time cell already
ham,Happy new year to u too!,24,2023-02-23 16:00:00,happy new year u
ham,"Hey...Great deal...Farm tour 9am to 5pm $95/pax, $50 deposit by 16 May",70,2023-02-23 17:00:00,heygreat dealfarm tour pm pax deposit may
ham,Eat jap done oso aft ur lect wat... ÌÏ got lect at 12 rite... ,62,2023-02-23 18:00:00,eat jap done oso aft ur lect wat got lect rite
ham,"Hey babe! I saw you came online for a second and then you disappeared, what happened ?",86,2023-02-23 19:00:00,hey babe saw came online second disappeared happened
ham,Da my birthdate in certificate is in april but real date is today. But dont publish it. I shall give you a special treat if you keep the secret. Any way thanks for the wishes,174,2023-02-23 20:00:00,da birthdate certificate april real date today dont publish shall give special treat keep secret way thanks wish
ham,Happy birthday... May all ur dreams come true...,48,2023-02-23 21:00:00,happy birthday may ur dream come true
ham,Aiyah u did ok already lar. E nydc at wheellock?,48,2023-02-23 22:00:00,aiyah u ok already lar e nydc wheellock
ham,TELL HER I SAID EAT SHIT.,25,2023-02-23 23:00:00,tell said eat shit
ham,Sure! I am driving but will reach my destination soon.,54,2023-02-24 00:00:00,sure driving reach destination soon
ham,"K so am I, how much for an 8th? Fifty?",38,2023-02-24 01:00:00,k much th fifty
ham,Your daily text from me ÛÒ a favour this time,46,2023-02-24 02:00:00,daily text favour time
ham,Great to hear you are settling well. So what's happenin wit ola?,64,2023-02-24 03:00:00,great hear settling well whats happenin wit ola
ham,Those cocksuckers. If it makes you feel better ipads are worthless garbage novelty items and you should feel bad for even wanting one,133,2023-02-24 04:00:00,cocksucker make feel better ipads worthless garbage novelty item feel bad even wanting one
ham,I tot u reach liao. He said t-shirt.,36,2023-02-24 05:00:00,tot u reach liao said tshirt
ham,"FRAN I DECIDED 2 GO N E WAY IM COMPLETELY BROKE AN KNACKERED I GOT UP BOUT 3 C U 2MRW LOVE JANX P.S THIS IS MY DADS FONE, -NO CREDIT",132,2023-02-24 06:00:00,fran decided go n e way im completely broke knackered got bout c u mrw love janx p dad fone credit
ham,I cant pick the phone right now. Pls send a message,51,2023-02-24 07:00:00,cant pick phone right pls send message
ham,Your right! I'll make the appointment right now.,48,2023-02-24 08:00:00,right ill make appointment right
ham,Designation is software developer and may be she get chennai:),62,2023-02-24 09:00:00,designation software developer may get chennai
spam,Enjoy the jamster videosound gold club with your credits for 2 new videosounds+2 logos+musicnews! get more fun from jamster.co.uk! 16+only Help? call: 09701213186 ,163,2023-02-24 10:00:00,enjoy jamster videosound gold club credit new videosounds logosmusicnews get fun jamstercouk help call
spam,"Get 3 Lions England tone, reply lionm 4 mono or lionp 4 poly. 4 more go 2 www.ringtones.co.uk, the original n best. Tones 3GBP network operator rates apply",155,2023-02-24 11:00:00,get lion england tone reply lionm mono lionp poly go wwwringtonescouk original n best tone gbp network operator rate apply
ham,I jokin oni lar.. ÌÏ busy then i wun disturb Ì_.,48,2023-02-24 12:00:00,jokin oni lar busy wun disturb
ham,"Ok, be careful ! Don't text and drive !",39,2023-02-24 13:00:00,ok careful dont text drive
ham,"I.ll always be there, even if its just in spirit. I.ll get a bb soon. Just trying to be sure i need it.",103,2023-02-24 14:00:00,ill always even spirit ill get bb soon trying sure need
ham,U r too much close to my heart. If u go away i will be shattered. Plz stay with me.,83,2023-02-24 15:00:00,u r much close heart u go away shattered plz stay
ham,I love u 2 babe! R u sure everything is alrite. Is he being an idiot? Txt bak girlie,84,2023-02-24 16:00:00,love u babe r u sure everything alrite idiot txt bak girlie
ham,How abt making some of the pics bigger?,39,2023-02-24 17:00:00,abt making pic bigger
ham,Got but got 2 colours lor. One colour is quite light n e other is darker lor. Actually i'm done she's styling my hair now.,122,2023-02-24 18:00:00,got got colour lor one colour quite light n e darker lor actually im done shes styling hair
ham,"Whenevr ur sad, Whenevr ur gray, Remembr im here 2 listn 2 watevr u wanna say, Jus walk wid me a little while,&amp; I promise I'll bring back ur smile.:-)",154,2023-02-24 19:00:00,whenevr ur sad whenevr ur gray remembr im listn watevr u wanna say jus walk wid little whileamp promise ill bring back ur smile
ham,Why nothing. Ok anyway give me treat,36,2023-02-24 20:00:00,nothing ok anyway give treat
spam,"Win the newest ÛÏHarry Potter and the Order of the Phoenix (Book 5) reply HARRY, answer 5 questions - chance to be the first among readers!",140,2023-02-24 21:00:00,win newest harry potter order phoenix book reply harry answer question chance first among reader
ham,Ok...,5,2023-02-24 22:00:00,ok
ham,Correct. So how was work today,30,2023-02-24 23:00:00,correct work today
ham,"Just sent again. Do you scream and moan in bed, princess?",57,2023-02-25 00:00:00,sent scream moan bed princess
ham,"I wake up long ago already... Dunno, what other thing?",54,2023-02-25 01:00:00,wake long ago already dunno thing
ham,Oh just getting even with u.... u?,34,2023-02-25 02:00:00,oh getting even u u
ham,I thk 50 shd be ok he said plus minus 10.. Did Ì_ leave a line in between paragraphs?,85,2023-02-25 03:00:00,thk shd ok said plus minus leave line paragraph
ham,Can you call me plz. Your number shows out of coveragd area. I have urgnt call in vasai &amp; have to reach before 4'o clock so call me plz,139,2023-02-25 04:00:00,call plz number show coveragd area urgnt call vasai amp reach clock call plz
ham,Yeah jay's sort of a fucking retard,35,2023-02-25 05:00:00,yeah jay sort fucking retard
ham,"Sorry, was in the bathroom, sup",31,2023-02-25 06:00:00,sorry bathroom sup
spam,Ur balance is now å£500. Ur next question is: Who sang 'Uptown Girl' in the 80's ? 2 answer txt ur ANSWER to 83600. Good luck!,126,2023-02-25 07:00:00,ur balance ur next question sang uptown girl answer txt ur answer good luck
ham,My exam is for february 4. Wish you a great day.,48,2023-02-25 08:00:00,exam february wish great day
ham,I dont know what to do to come out of this so only am ask questions like this dont mistake me.,94,2023-02-25 09:00:00,dont know come ask question like dont mistake
ham,"Aight no rush, I'll ask jay",27,2023-02-25 10:00:00,aight rush ill ask jay
ham,Good Morning plz call me sir,28,2023-02-25 11:00:00,good morning plz call sir
ham,It's ok lar. U sleep early too... Nite...,41,2023-02-25 12:00:00,ok lar u sleep early nite
ham,"Oh... Icic... K lor, den meet other day...",42,2023-02-25 13:00:00,oh icic k lor den meet day
ham,"Oh ! A half hour is much longer in Syria than Canada, eh ? Wow you must get SO much more work done in a day than us with all that extra time ! *grins*",150,2023-02-25 14:00:00,oh half hour much longer syria canada eh wow must get much work done day u extra time grin
ham,"Sometimes we put walls around our hearts,not just to be safe from getting hurt.. But to find out who cares enough to break the walls &amp; get closer.. GOODNOON:)",162,2023-02-25 15:00:00,sometimes put wall around heartsnot safe getting hurt find care enough break wall amp get closer goodnoon
ham,"Sweet, we may or may not go to 4U to meet carlos so gauge patty's interest in that",82,2023-02-25 16:00:00,sweet may may go u meet carlos gauge patty interest
ham,Then she buying today? ÌÏ no need to c meh...,45,2023-02-25 17:00:00,buying today need c meh
ham,Aight sorry I take ten years to shower. What's the plan?,56,2023-02-25 18:00:00,aight sorry take ten year shower whats plan
ham,Every monday..nxt week vl be completing..,41,2023-02-25 19:00:00,every mondaynxt week vl completing
ham,Might ax well im there.,23,2023-02-25 20:00:00,might ax well im
ham,Just chill for another 6hrs. If you could sleep the pain is not a surgical emergency so see how it unfolds. Okay,112,2023-02-25 21:00:00,chill another hr could sleep pain surgical emergency see unfolds okay
ham,Yeah I'll try to scrounge something up,38,2023-02-25 22:00:00,yeah ill try scrounge something
ham,Crazy ar he's married. ÌÏ like gd looking guys not me. My frens like say he's korean leona's fave but i dun thk he is. Aft some thinking mayb most prob i'll go.,160,2023-02-25 23:00:00,crazy ar he married like gd looking guy frens like say he korean leonas fave dun thk aft thinking mayb prob ill go
ham,Were somewhere on Fredericksburg,32,2023-02-26 00:00:00,somewhere fredericksburg
ham,Que pases un buen tiempo or something like that,47,2023-02-26 01:00:00,que pas un buen tiempo something like
ham,Is it ok if I stay the night here? Xavier has a sleeping bag and I'm getting tired,82,2023-02-26 02:00:00,ok stay night xavier sleeping bag im getting tired
ham,She doesnt need any test.,25,2023-02-26 03:00:00,doesnt need test
ham,"Nothing much, chillin at home. Any super bowl plan?",51,2023-02-26 04:00:00,nothing much chillin home super bowl plan
spam,"FREE2DAY sexy St George's Day pic of Jordan!Txt PIC to 89080 dont miss out, then every wk a saucy celeb!4 more pics c PocketBabe.co.uk 0870241182716 å£3/wk",155,2023-02-26 05:00:00,freeday sexy st george day pic jordantxt pic dont miss every wk saucy celeb pic c pocketbabecouk wk
ham,Bugis oso near wat... ,22,2023-02-26 06:00:00,bugis oso near wat
ham,Yo theres no class tmrw right?,30,2023-02-26 07:00:00,yo there class tmrw right
ham,Let Ur Heart Be Ur Compass Ur Mind Ur Map Ur Soul Ur Guide And U Will Never loose in world....gnun - Sent via WAY2SMS.COM,121,2023-02-26 08:00:00,let ur heart ur compass ur mind ur map ur soul ur guide u never loose worldgnun sent via waysmscom
ham,"Goodnight, sleep well da please take care pa. Please.",53,2023-02-26 09:00:00,goodnight sleep well da please take care pa please
ham,Baaaaabe! I misss youuuuu ! Where are you ? I have to go and teach my class at 5 ...,84,2023-02-26 10:00:00,baaaaabe miss youuuuu go teach class
ham,Convey my regards to him,24,2023-02-26 11:00:00,convey regard
ham,U ned to convince him tht its not possible witot hurting his feeling its the main,81,2023-02-26 12:00:00,u ned convince tht possible witot hurting feeling main
ham,"Good afternoon loverboy ! How goes you day ? Any luck come your way? I think of you, sweetie and send my love across the sea to make you smile and happy",152,2023-02-26 13:00:00,good afternoon loverboy go day luck come way think sweetie send love across sea make smile happy
ham,If i start sending blackberry torch to nigeria will you find buyer for me?like 4a month. And tell dad not to buy bb from anyone oh.,131,2023-02-26 14:00:00,start sending blackberry torch nigeria find buyer melike month tell dad buy bb anyone oh
ham,"&lt;#&gt; %of pple marry with their lovers... becz they hav gud undrstndng dat avoids problems. i sent dis 2 u, u wil get gud news on friday by d person you like. And tomorrow will be the best day of your life. Dont break this chain. If you break you will suffer. send this to  &lt;#&gt;  frnds in &lt;#&gt;  mins whn u read...",327,2023-02-26 15:00:00,ltgt pple marry lover becz hav gud undrstndng dat avoids problem sent dis u u wil get gud news friday person like tomorrow best day life dont break chain break suffer send ltgt frnds ltgt min whn u read
ham,Yo dude guess who just got arrested the other day,49,2023-02-26 16:00:00,yo dude guess got arrested day
ham,Shuhui say change 2 suntec steamboat? U noe where? Where r u now?,65,2023-02-26 17:00:00,shuhui say change suntec steamboat u noe r u
ham,What does the dance river do?,29,2023-02-26 18:00:00,dance river
ham,"Yetunde, i'm sorry but moji and i seem too busy to be able to go shopping. Can you just please find some other way to get what you wanted us to get. Please forgive me. You can reply free via yahoo messenger.",207,2023-02-26 19:00:00,yetunde im sorry moji seem busy able go shopping please find way get wanted u get please forgive reply free via yahoo messenger
ham,Hey i will be really pretty late... You want to go for the lesson first? I will join you. I'm only reaching tp mrt,114,2023-02-26 20:00:00,hey really pretty late want go lesson first join im reaching tp mrt
spam,"HOT LIVE FANTASIES call now 08707509020 Just 20p per min NTT Ltd, PO Box 1327 Croydon CR9 5WB 0870..k",101,2023-02-26 21:00:00,hot live fantasy call p per min ntt ltd po box croydon cr wb k
ham,Bbq this sat at mine from 6ish. Ur welcome 2 come,49,2023-02-26 22:00:00,bbq sat mine ish ur welcome come
ham,"I don't know, same thing that's wrong everyso often, he panicks starts goin on bout not bein good enough Û_",108,2023-02-26 23:00:00,dont know thing thats wrong everyso often panicks start goin bout bein good enough
ham,Alright. I'm out--have a good night!,36,2023-02-27 00:00:00,alright im outhave good night
ham,Did you try making another butt.,32,2023-02-27 01:00:00,try making another butt
ham,Hope you are feeling great. Pls fill me in. Abiola,50,2023-02-27 02:00:00,hope feeling great pls fill abiola
ham,I though we shd go out n have some fun so bar in town or something ÛÒ sound ok?,80,2023-02-27 03:00:00,though shd go n fun bar town something sound ok
ham,"1) Go to write msg 2) Put on Dictionary mode 3)Cover the screen with hand, 4)Press  &lt;#&gt; . 5)Gently remove Ur hand.. Its interesting..:)",141,2023-02-27 04:00:00,go write msg put dictionary mode cover screen hand press ltgt gently remove ur hand interesting
spam,"Bears Pic Nick, and Tom, Pete and ... Dick. In fact, all types try gay chat with photo upload call 08718730666 (10p/min). 2 stop texts call 08712460324",151,2023-02-27 05:00:00,bear pic nick tom pete dick fact type try gay chat photo upload call pmin stop text call
spam,"500 New Mobiles from 2004, MUST GO! Txt: NOKIA to No: 89545 & collect yours today!From ONLY å£1 www.4-tc.biz 2optout 087187262701.50gbp/mtmsg18 TXTAUCTION",154,2023-02-27 06:00:00,new mobile must go txt nokia collect todayfrom wwwtcbiz optout gbpmtmsg txtauction
ham,We're finally ready fyi,23,2023-02-27 07:00:00,finally ready fyi
ham,Auntie huai juan never pick up her phone,40,2023-02-27 08:00:00,auntie huai juan never pick phone
spam,Double Mins & Double Txt & 1/2 price Linerental on Latest Orange Bluetooth mobiles. Call MobileUpd8 for the very latest offers. 08000839402 or call2optout/LF56,159,2023-02-27 09:00:00,double min double txt price linerental latest orange bluetooth mobile call mobileupd latest offer calloptoutlf
ham,"Ya tel, wats ur problem..",25,2023-02-27 10:00:00,ya tel wats ur problem
spam,No. 1 Nokia Tone 4 ur mob every week! Just txt NOK to 87021. 1st Tone FREE ! so get txtin now and tell ur friends. 150p/tone. 16 reply HL 4info,143,2023-02-27 11:00:00,nokia tone ur mob every week txt nok st tone free get txtin tell ur friend ptone reply hl info
ham,i dnt wnt to tlk wid u,22,2023-02-27 12:00:00,dnt wnt tlk wid u
ham,"We spend our days waiting for the ideal path to appear in front of us.. But what we forget is.. \paths are made by walking.. not by waiting..\"" Goodnight!""",155,2023-02-27 13:00:00,spend day waiting ideal path appear front u forget path made walking waiting goodnight
ham,Its ok my arm is feeling weak cuz i got a shot so we can go another time,72,2023-02-27 14:00:00,ok arm feeling weak cuz got shot go another time
ham,Please reserve ticket on saturday eve from chennai to thirunelvali and again from tirunelvali to chennai on sunday eve...i already see in net..no ticket available..i want to book ticket through tackle ..,203,2023-02-27 15:00:00,please reserve ticket saturday eve chennai thirunelvali tirunelvali chennai sunday evei already see netno ticket availablei want book ticket tackle
ham,"Storming msg: Wen u lift d phne, u say \HELLO\"" Do u knw wt is d real meaning of HELLO?? . . . It's d name of a girl..! . . . Yes.. And u knw who is dat girl?? \""Margaret Hello\"" She is d girlfrnd f Grahmbell who invnted telphone... . . . . Moral:One can 4get d name of a person",278,2023-02-27 16:00:00,storming msg wen u lift phne u say hello u knw wt real meaning hello name girl yes u knw dat girl margaret hello girlfrnd f grahmbell invnted telphone moralone get name person
ham,That's ok. I popped in to ask bout something and she said you'd been in. Are you around tonght wen this girl comes?,115,2023-02-27 17:00:00,thats ok popped ask bout something said youd around tonght wen girl come
ham,All e best 4 ur exam later.,27,2023-02-27 18:00:00,e best ur exam later
ham,Hope ur head doesn't hurt 2 much ! Am ploughing my way through a pile of ironing ! Staying in with a chinky tonight come round if you like.,139,2023-02-27 19:00:00,hope ur head doesnt hurt much ploughing way pile ironing staying chinky tonight come round like
ham,Oh k.i think most of wi and nz players unsold.,46,2023-02-27 20:00:00,oh ki think wi nz player unsold
ham,"Haha... Where got so fast lose weight, thk muz go 4 a month den got effect... Gee,later we go aust put bk e weight.",115,2023-02-27 21:00:00,haha got fast lose weight thk muz go month den got effect geelater go aust put bk e weight
ham,"I wonder how you got online, my love ? Had you gone to the net cafe ? Did you get your phone recharged ? Were you on a friends net ? I think of you, boytoy",155,2023-02-27 22:00:00,wonder got online love gone net cafe get phone recharged friend net think boytoy
ham,"Haha just kidding, papa needs drugs",35,2023-02-27 23:00:00,haha kidding papa need drug
ham,"Thk shld b can... Ya, i wana go 4 lessons... Haha, can go for one whole stretch...",82,2023-02-28 00:00:00,thk shld b ya wana go lesson haha go one whole stretch
ham,Oh ok..,7,2023-02-28 01:00:00,oh ok
ham,R we still meeting 4 dinner tonight?,36,2023-02-28 02:00:00,r still meeting dinner tonight
ham,Thats cool! I am a gentleman and will treat you with dignity and respect.,73,2023-02-28 03:00:00,thats cool gentleman treat dignity respect
ham,Shall i start from hear.,24,2023-02-28 04:00:00,shall start hear
ham,Then we wait 4 u lor... No need 2 feel bad lar...,49,2023-02-28 05:00:00,wait u lor need feel bad lar
ham,No did you check? I got his detailed message now,48,2023-02-28 06:00:00,check got detailed message
ham,You have registered Sinco as Payee. Log in at icicibank.com and enter URN  &lt;#&gt;  to confirm. Beware of frauds. Do NOT share or disclose URN to anyone.,155,2023-02-28 07:00:00,registered sinco payee log icicibankcom enter urn ltgt confirm beware fraud share disclose urn anyone
ham,"No, I decided that only people who care about stuff vote and caring about stuff is for losers",93,2023-02-28 08:00:00,decided people care stuff vote caring stuff loser
ham,Kaiez... Enjoy ur tuition... Gee... Thk e second option sounds beta... I'll go yan jiu den msg u...,99,2023-02-28 09:00:00,kaiez enjoy ur tuition gee thk e second option sound beta ill go yan jiu den msg u
ham,You have registered Sinco as Payee. Log in at icicibank.com and enter URN  &lt;#&gt;  to confirm. Beware of frauds. Do NOT share or disclose URN to anyone.,155,2023-02-28 10:00:00,registered sinco payee log icicibankcom enter urn ltgt confirm beware fraud share disclose urn anyone
ham,cool. We will have fun practicing making babies!,48,2023-02-28 11:00:00,cool fun practicing making baby
ham,Actually getting ready to leave the house.,42,2023-02-28 12:00:00,actually getting ready leave house
ham,K..k..any special today?,24,2023-02-28 13:00:00,kkany special today
spam,"URGENT, IMPORTANT INFORMATION FOR O2 USER. TODAY IS YOUR LUCKY DAY! 2 FIND OUT WHY LOG ONTO HTTP://WWW.URAWINNER.COM THERE IS A FANTASTIC SURPRISE AWAITING FOR YOU",163,2023-02-28 14:00:00,urgent important information user today lucky day find log onto httpwwwurawinnercom fantastic surprise awaiting
ham,Then we gotta do it after that,30,2023-02-28 15:00:00,gotta
ham,"I've got ten bucks, jay is being noncomittal",44,2023-02-28 16:00:00,ive got ten buck jay noncomittal
ham,Where at were hungry too,24,2023-02-28 17:00:00,hungry
ham,Pls speak to that customer machan.,34,2023-02-28 18:00:00,pls speak customer machan
ham,somewhere out there beneath the pale moon light someone think in of u some where out there where dreams come true... goodnite &amp; sweet dreams,144,2023-02-28 19:00:00,somewhere beneath pale moon light someone think u dream come true goodnite amp sweet dream
ham,"Wen ur lovable bcums angry wid u, dnt take it seriously.. Coz being angry is d most childish n true way of showing deep affection, care n luv!.. kettoda manda... Have nice day da.",179,2023-02-28 20:00:00,wen ur lovable bcums angry wid u dnt take seriously coz angry childish n true way showing deep affection care n luv kettoda manda nice day da
spam,Dear U've been invited to XCHAT. This is our final attempt to contact u! Txt CHAT to 86688 150p/MsgrcvdHG/Suite342/2Lands/Row/W1J6HL LDN 18 yrs,143,2023-02-28 21:00:00,dear uve invited xchat final attempt contact u txt chat pmsgrcvdhgsuitelandsrowwjhl ldn yr
ham,So wats ur opinion abt him and how abt is character?,52,2023-02-28 22:00:00,wats ur opinion abt abt character
ham,Jay is snickering and tells me that x is totally fucking up the chords as we speak,82,2023-02-28 23:00:00,jay snickering tell x totally fucking chord speak
ham,No..few hours before.went to hair cut .,39,2023-03-01 00:00:00,nofew hour beforewent hair cut
ham,No wonder... Cos i dun rem seeing a silver car... But i thk i saw a black one...,80,2023-03-01 01:00:00,wonder co dun rem seeing silver car thk saw black one
ham,Lmao. Take a pic and send it to me.,35,2023-03-01 02:00:00,lmao take pic send
