label,text,message_length,timestamp,cleaned_text
ham,"Go until jurong point, crazy.. Available only in bugis n great world la e buffet... Cine there got amore wat...",111,2023-01-01 00:00:00,go jurong point crazy available bugis n great world la e buffet cine got amore wat
ham,Ok lar... Joking wif u oni...,29,2023-01-01 01:00:00,ok lar joking wif u oni
spam,Free entry in 2 a wkly comp to win FA Cup final tkts 21st May 2005. Text FA to 87121 to receive entry question(std txt rate)T&C's apply 08452810075over18's,155,2023-01-01 02:00:00,free entry wkly comp win fa cup final tkts st may text fa receive entry questionstd txt ratetcs apply over
ham,U dun say so early hor... U c already then say...,49,2023-01-01 03:00:00,u dun say early hor u c already say
ham,"Nah I don't think he goes to usf, he lives around here though",61,2023-01-01 04:00:00,nah dont think go usf life around though
spam,"FreeMsg Hey there darling it's been 3 week's now and no word back! I'd like some fun you up for it still? Tb ok! XxX std chgs to send, å£1.50 to rcv",148,2023-01-01 05:00:00,freemsg hey darling week word back id like fun still tb ok xxx std chgs send rcv
ham,Even my brother is not like to speak with me. They treat me like aids patent.,77,2023-01-01 06:00:00,even brother like speak treat like aid patent
ham,As per your request 'Melle Melle (Oru Minnaminunginte Nurungu Vettam)' has been set as your callertune for all Callers. Press *9 to copy your friends Callertune,160,2023-01-01 07:00:00,per request melle melle oru minnaminunginte nurungu vettam set callertune caller press copy friend callertune
spam,WINNER!! As a valued network customer you have been selected to receivea å£900 prize reward! To claim call 09061701461. Claim code KL341. Valid 12 hours only.,158,2023-01-01 08:00:00,winner valued network customer selected receivea prize reward claim call claim code kl valid hour
spam,Had your mobile 11 months or more? U R entitled to Update to the latest colour mobiles with camera for Free! Call The Mobile Update Co FREE on 08002986030,154,2023-01-01 09:00:00,mobile month u r entitled update latest colour mobile camera free call mobile update co free
ham,"I'm gonna be home soon and i don't want to talk about this stuff anymore tonight, k? I've cried enough today.",109,2023-01-01 10:00:00,im gonna home soon dont want talk stuff anymore tonight k ive cried enough today
spam,"SIX chances to win CASH! From 100 to 20,000 pounds txt> CSH11 and send to 87575. Cost 150p/day, 6days, 16+ TsandCs apply Reply HL 4 info",136,2023-01-01 11:00:00,six chance win cash pound txt csh send cost pday day tsandcs apply reply hl info
spam,"URGENT! You have won a 1 week FREE membership in our å£100,000 Prize Jackpot! Txt the word: CLAIM to No: 81010 T&C www.dbuk.net LCCLTD POBOX 4403LDNW1A7RW18",156,2023-01-01 12:00:00,urgent week free membership prize jackpot txt word claim tc wwwdbuknet lccltd pobox ldnwarw
ham,I've been searching for the right words to thank you for this breather. I promise i wont take your help for granted and will fulfil my promise. You have been wonderful and a blessing at all times.,196,2023-01-01 13:00:00,ive searching right word thank breather promise wont take help granted fulfil promise wonderful blessing time
ham,I HAVE A DATE ON SUNDAY WITH WILL!!,35,2023-01-01 14:00:00,date sunday
spam,"XXXMobileMovieClub: To use your credit, click the WAP link in the next txt message or click here>> http://wap. xxxmobilemovieclub.com?n=QJKGIGHJJGCBL",149,2023-01-01 15:00:00,xxxmobilemovieclub use credit click wap link next txt message click httpwap xxxmobilemovieclubcomnqjkgighjjgcbl
ham,Oh k...i'm watching here:),26,2023-01-01 16:00:00,oh kim watching
ham,Eh u remember how 2 spell his name... Yes i did. He v naughty make until i v wet.,81,2023-01-01 17:00:00,eh u remember spell name yes v naughty make v wet
ham,Fine if thatåÕs the way u feel. ThatåÕs the way its gota b,58,2023-01-01 18:00:00,fine thats way u feel thats way gota b
spam,"England v Macedonia - dont miss the goals/team news. Txt ur national team to 87077 eg ENGLAND to 87077 Try:WALES, SCOTLAND 4txt/Ì¼1.20 POBOXox36504W45WQ 16+",156,2023-01-01 19:00:00,england v macedonia dont miss goalsteam news txt ur national team eg england trywales scotland txt poboxoxwwq
ham,Is that seriously how you spell his name?,41,2023-01-01 20:00:00,seriously spell name
ham,IÛ÷m going to try for 2 months ha ha only joking,49,2023-01-01 21:00:00,im going try month ha ha joking
ham,So Ì_ pay first lar... Then when is da stock comin...,53,2023-01-01 22:00:00,pay first lar da stock comin
ham,Aft i finish my lunch then i go str down lor. Ard 3 smth lor. U finish ur lunch already?,88,2023-01-01 23:00:00,aft finish lunch go str lor ard smth lor u finish ur lunch already
ham,Ffffffffff. Alright no way I can meet up with you sooner?,57,2023-01-02 00:00:00,ffffffffff alright way meet sooner
ham,Just forced myself to eat a slice. I'm really not hungry tho. This sucks. Mark is getting worried. He knows I'm sick when I turn down pizza. Lol,144,2023-01-02 01:00:00,forced eat slice im really hungry tho suck mark getting worried know im sick turn pizza lol
ham,Lol your always so convincing.,30,2023-01-02 02:00:00,lol always convincing
ham,Did you catch the bus ? Are you frying an egg ? Did you make a tea? Are you eating your mom's left over dinner ? Do you feel my Love ?,134,2023-01-02 03:00:00,catch bus frying egg make tea eating mom left dinner feel love
ham,"I'm back &amp; we're packing the car now, I'll let you know if there's room",75,2023-01-02 04:00:00,im back amp packing car ill let know there room
ham,Ahhh. Work. I vaguely remember that! What does it feel like? Lol,64,2023-01-02 05:00:00,ahhh work vaguely remember feel like lol
ham,"Wait that's still not all that clear, were you not sure about me being sarcastic or that that's why x doesn't want to live with us",130,2023-01-02 06:00:00,wait thats still clear sure sarcastic thats x doesnt want live u
ham,Yeah he got in at 2 and was v apologetic. n had fallen out and she was actin like spoilt child and he got caught up in that. Till 2! But we won't go there! Not doing too badly cheers. You? ,189,2023-01-02 07:00:00,yeah got v apologetic n fallen actin like spoilt child got caught till wont go badly cheer
ham,K tell me anything about you.,29,2023-01-02 08:00:00,k tell anything
ham,For fear of fainting with the of all that housework you just did? Quick have a cuppa,84,2023-01-02 09:00:00,fear fainting housework quick cuppa
spam,Thanks for your subscription to Ringtone UK your mobile will be charged å£5/month Please confirm by replying YES or NO. If you reply NO you will not be charged,159,2023-01-02 10:00:00,thanks subscription ringtone uk mobile charged month please confirm replying yes reply charged
ham,Yup... Ok i go home look at the timings then i msg Ì_ again... Xuhui going to learn on 2nd may too but her lesson is at 8am,123,2023-01-02 11:00:00,yup ok go home look timing msg xuhui going learn nd may lesson
ham,"Oops, I'll let you know when my roommate's done",47,2023-01-02 12:00:00,oops ill let know roommate done
ham,I see the letter B on my car,28,2023-01-02 13:00:00,see letter b car
ham,Anything lor... U decide...,27,2023-01-02 14:00:00,anything lor u decide
ham,Hello! How's you and how did saturday go? I was just texting to see if you'd decided to do anything tomo. Not that i'm trying to invite myself or anything!,155,2023-01-02 15:00:00,hello hows saturday go texting see youd decided anything tomo im trying invite anything
ham,Pls go ahead with watts. I just wanted to be sure. Do have a great weekend. Abiola,82,2023-01-02 16:00:00,pls go ahead watt wanted sure great weekend abiola
ham,"Did I forget to tell you ? I want you , I need you, I crave you ... But most of all ... I love you my sweet Arabian steed ... Mmmmmm ... Yummy",142,2023-01-02 17:00:00,forget tell want need crave love sweet arabian steed mmmmmm yummy
spam,07732584351 - Rodger Burns - MSG = We tried to call you re your reply to our sms for a free nokia mobile + free camcorder. Please call now 08000930705 for delivery tomorrow,172,2023-01-02 18:00:00,rodger burn msg tried call reply sm free nokia mobile free camcorder please call delivery tomorrow
ham,WHO ARE YOU SEEING?,19,2023-01-02 19:00:00,seeing
ham,Great! I hope you like your man well endowed. I am  &lt;#&gt;  inches...,72,2023-01-02 20:00:00,great hope like man well endowed ltgt inch
ham,No calls..messages..missed calls,32,2023-01-02 21:00:00,callsmessagesmissed call
ham,Didn't you get hep b immunisation in nigeria.,45,2023-01-02 22:00:00,didnt get hep b immunisation nigeria
ham,"Fair enough, anything going on?",31,2023-01-02 23:00:00,fair enough anything going
ham,"Yeah hopefully, if tyler can't do it I could maybe ask around a bit",67,2023-01-03 00:00:00,yeah hopefully tyler cant could maybe ask around bit
ham,U don't know how stubborn I am. I didn't even want to go to the hospital. I kept telling Mark I'm not a weak sucker. Hospitals are for weak suckers.,148,2023-01-03 01:00:00,u dont know stubborn didnt even want go hospital kept telling mark im weak sucker hospital weak sucker
ham,What you thinked about me. First time you saw me in class.,58,2023-01-03 02:00:00,thinked first time saw class
ham,"A gram usually runs like  &lt;#&gt; , a half eighth is smarter though and gets you almost a whole second gram for  &lt;#&gt;",124,2023-01-03 03:00:00,gram usually run like ltgt half eighth smarter though get almost whole second gram ltgt
ham,K fyi x has a ride early tomorrow morning but he's crashing at our place tonight,80,2023-01-03 04:00:00,k fyi x ride early tomorrow morning he crashing place tonight
ham,"Wow. I never realized that you were so embarassed by your accomodations. I thought you liked it, since i was doing the best i could and you always seemed so happy about \the cave\"". I'm sorry I didn't and don't have more to give. I'm sorry i offered. I'm sorry your room was so embarassing.""",291,2023-01-03 05:00:00,wow never realized embarassed accomodations thought liked since best could always seemed happy cave im sorry didnt dont give im sorry offered im sorry room embarassing
spam,SMS. ac Sptv: The New Jersey Devils and the Detroit Red Wings play Ice Hockey. Correct or Incorrect? End? Reply END SPTV,120,2023-01-03 06:00:00,sm ac sptv new jersey devil detroit red wing play ice hockey correct incorrect end reply end sptv
ham,Do you know what Mallika Sherawat did yesterday? Find out now @  &lt;URL&gt;,76,2023-01-03 07:00:00,know mallika sherawat yesterday find lturlgt
spam,"Congrats! 1 year special cinema pass for 2 is yours. call 09061209465 now! C Suprman V, Matrix3, StarWars3, etc all 4 FREE! bx420-ip4-5we. 150pm. Dont miss out! ",161,2023-01-03 08:00:00,congrats year special cinema pas call c suprman v matrix starwars etc free bxipwe pm dont miss
ham,"Sorry, I'll call later in meeting.",34,2023-01-03 09:00:00,sorry ill call later meeting
ham,Tell where you reached,22,2023-01-03 10:00:00,tell reached
ham,Yes..gauti and sehwag out of odi series.,40,2023-01-03 11:00:00,yesgauti sehwag odi series
ham,Your gonna have to pick up a $1 burger for yourself on your way home. I can't even move. Pain is killing me.,108,2023-01-03 12:00:00,gonna pick burger way home cant even move pain killing
ham,Ha ha ha good joke. Girls are situation seekers.,48,2023-01-03 13:00:00,ha ha ha good joke girl situation seeker
ham,Its a part of checking IQ,25,2023-01-03 14:00:00,part checking iq
ham,"Sorry my roommates took forever, it ok if I come by now?",56,2023-01-03 15:00:00,sorry roommate took forever ok come
ham,Ok lar i double check wif da hair dresser already he said wun cut v short. He said will cut until i look nice.,110,2023-01-03 16:00:00,ok lar double check wif da hair dresser already said wun cut v short said cut look nice
spam,"As a valued customer, I am pleased to advise you that following recent review of your Mob No. you are awarded with a å£1500 Bonus Prize, call 09066364589",153,2023-01-03 17:00:00,valued customer pleased advise following recent review mob awarded bonus prize call
ham,"Today is \song dedicated day..\"" Which song will u dedicate for me? Send this to all ur valuable frnds but first rply me...""",124,2023-01-03 18:00:00,today song dedicated day song u dedicate send ur valuable frnds first rply
spam,"Urgent UR awarded a complimentary trip to EuroDisinc Trav, Aco&Entry41 Or å£1000. To claim txt DIS to 87121 18+6*å£1.50(moreFrmMob. ShrAcomOrSglSuplt)10, LS1 3AJ",161,2023-01-03 19:00:00,urgent ur awarded complimentary trip eurodisinc trav acoentry claim txt dis morefrmmob shracomorsglsuplt l aj
spam,"Did you hear about the new \Divorce Barbie\""? It comes with all of Ken's stuff!""",80,2023-01-03 20:00:00,hear new divorce barbie come ken stuff
ham,I plane to give on this month end.,34,2023-01-03 21:00:00,plane give month end
ham,Wah lucky man... Then can save money... Hee...,46,2023-01-03 22:00:00,wah lucky man save money hee
ham,Finished class where are you.,29,2023-01-03 23:00:00,finished class
ham,HI BABE IM AT HOME NOW WANNA DO SOMETHING? XX,45,2023-01-04 00:00:00,hi babe im home wanna something xx
ham,K..k:)where are you?how did you performed?,42,2023-01-04 01:00:00,kkwhere youhow performed
ham,U can call me now...,20,2023-01-04 02:00:00,u call
ham,I am waiting machan. Call me once you free.,43,2023-01-04 03:00:00,waiting machan call free
ham,Thats cool. i am a gentleman and will treat you with dignity and respect.,73,2023-01-04 04:00:00,thats cool gentleman treat dignity respect
ham,I like you peoples very much:) but am very shy pa.,50,2023-01-04 05:00:00,like people much shy pa
ham,Does not operate after  &lt;#&gt;  or what,42,2023-01-04 06:00:00,operate ltgt
ham,Its not the same here. Still looking for a job. How much do Ta's earn there.,76,2023-01-04 07:00:00,still looking job much ta earn
ham,"Sorry, I'll call later",22,2023-01-04 08:00:00,sorry ill call later
ham,K. Did you call me just now ah? ,32,2023-01-04 09:00:00,k call ah
ham,Ok i am on the way to home hi hi,32,2023-01-04 10:00:00,ok way home hi hi
ham,You will be in the place of that man,36,2023-01-04 11:00:00,place man
ham,Yup next stop.,14,2023-01-04 12:00:00,yup next stop
ham,"I call you later, don't have network. If urgnt, sms me.",55,2023-01-04 13:00:00,call later dont network urgnt sm
ham,For real when u getting on yo? I only need 2 more tickets and one more jacket and I'm done. I already used all my multis.,121,2023-01-04 14:00:00,real u getting yo need ticket one jacket im done already used multis
ham,Yes I started to send requests to make it but pain came back so I'm back in bed. Double coins at the factory too. I gotta cash in all my nitros.,144,2023-01-04 15:00:00,yes started send request make pain came back im back bed double coin factory gotta cash nitros
ham,I'm really not up to it still tonight babe,42,2023-01-04 16:00:00,im really still tonight babe
ham,"Ela kano.,il download, come wen ur free..",41,2023-01-04 17:00:00,ela kanoil download come wen ur free
ham,Yeah do! DonÛ÷t stand to close tho- youÛ÷ll catch something!,62,2023-01-04 18:00:00,yeah dont stand close tho youll catch something
ham,Sorry to be a pain. Is it ok if we meet another night? I spent late afternoon in casualty and that means i haven't done any of y stuff42moro and that includes all my time sheets and that. Sorry. ,195,2023-01-04 19:00:00,sorry pain ok meet another night spent late afternoon casualty mean havent done stuffmoro includes time sheet sorry
ham,Smile in Pleasure Smile in Pain Smile when trouble pours like Rain Smile when sum1 Hurts U Smile becoz SOMEONE still Loves to see u Smiling!!,141,2023-01-04 20:00:00,smile pleasure smile pain smile trouble pours like rain smile sum hurt u smile becoz someone still love see u smiling
spam,Please call our customer service representative on 0800 169 6031 between 10am-9pm as you have WON a guaranteed å£1000 cash or å£5000 prize!,139,2023-01-04 21:00:00,please call customer service representative ampm guaranteed cash prize
ham,Havent planning to buy later. I check already lido only got 530 show in e afternoon. U finish work already?,107,2023-01-04 22:00:00,havent planning buy later check already lido got show e afternoon u finish work already
spam,"Your free ringtone is waiting to be collected. Simply text the password \MIX\"" to 85069 to verify. Get Usher and Britney. FML",125,2023-01-04 23:00:00,free ringtone waiting collected simply text password mix verify get usher britney fml
ham,Watching telugu movie..wat abt u?,33,2023-01-05 00:00:00,watching telugu moviewat abt u
ham,i see. When we finish we have loads of loans to pay,51,2023-01-05 01:00:00,see finish load loan pay
ham,"Hi. Wk been ok - on hols now! Yes on for a bit of a run. Forgot that i have hairdressers appointment at four so need to get home n shower beforehand. Does that cause prob for u?\""ham""",184,2023-01-05 02:00:00,hi wk ok hols yes bit run forgot hairdresser appointment four need get home n shower beforehand cause prob u ham
ham,Please don't text me anymore. I have nothing else to say.,57,2023-01-05 03:00:00,please dont text anymore nothing else say
ham,Okay name ur price as long as its legal! Wen can I pick them up? Y u ave x ams xx,81,2023-01-05 04:00:00,okay name ur price long legal wen pick u ave x am xx
ham,I'm still looking for a car to buy. And have not gone 4the driving test yet.,76,2023-01-05 05:00:00,im still looking car buy gone driving test yet
ham,As per your request 'Melle Melle (Oru Minnaminunginte Nurungu Vettam)' has been set as your callertune for all Callers. Press *9 to copy your friends Callertune,160,2023-01-05 06:00:00,per request melle melle oru minnaminunginte nurungu vettam set callertune caller press copy friend callertune
ham,"wow. You're right! I didn't mean to do that. I guess once i gave up on boston men and changed my search location to nyc, something changed. Cuz on my signin page it still says boston.",183,2023-01-05 07:00:00,wow youre right didnt mean guess gave boston men changed search location nyc something changed cuz signin page still say boston
ham,Umma my life and vava umma love you lot dear,44,2023-01-05 08:00:00,umma life vava umma love lot dear
ham,Thanks a lot for your wishes on my birthday. Thanks you for making my birthday truly memorable.,95,2023-01-05 09:00:00,thanks lot wish birthday thanks making birthday truly memorable
ham,"Aight, I'll hit you up when I get some cash",43,2023-01-05 10:00:00,aight ill hit get cash
ham,How would my ip address test that considering my computer isn't a minecraft server,82,2023-01-05 11:00:00,would ip address test considering computer isnt minecraft server
ham,I know! Grumpy old people. My mom was like you better not be lying. Then again I am always the one to play jokes...,115,2023-01-05 12:00:00,know grumpy old people mom like better lying always one play joke
ham,Dont worry. I guess he's busy.,30,2023-01-05 13:00:00,dont worry guess he busy
ham,What is the plural of the noun research?,40,2023-01-05 14:00:00,plural noun research
ham,Going for dinner.msg you after.,31,2023-01-05 15:00:00,going dinnermsg
ham,I'm ok wif it cos i like 2 try new things. But i scared u dun like mah. Cos u said not too loud.,96,2023-01-05 16:00:00,im ok wif co like try new thing scared u dun like mah co u said loud
spam,GENT! We are trying to contact you. Last weekends draw shows that you won a å£1000 prize GUARANTEED. Call 09064012160. Claim Code K52. Valid 12hrs only. 150ppm,159,2023-01-05 17:00:00,gent trying contact last weekend draw show prize guaranteed call claim code k valid hr ppm
ham,"Wa, ur openin sentence very formal... Anyway, i'm fine too, juz tt i'm eatin too much n puttin on weight...Haha... So anythin special happened?",143,2023-01-05 18:00:00,wa ur openin sentence formal anyway im fine juz tt im eatin much n puttin weighthaha anythin special happened
ham,"As I entered my cabin my PA said, '' Happy B'day Boss !!''. I felt special. She askd me 4 lunch. After lunch she invited me to her apartment. We went there.",156,2023-01-05 19:00:00,entered cabin pa said happy bday bos felt special askd lunch lunch invited apartment went
spam,You are a winner U have been specially selected 2 receive å£1000 or a 4* holiday (flights inc) speak to a live operator 2 claim 0871277810910p/min (18+) ,153,2023-01-05 20:00:00,winner u specially selected receive holiday flight inc speak live operator claim pmin
ham,Goodo! Yes we must speak friday - egg-potato ratio for tortilla needed! ,72,2023-01-05 21:00:00,goodo yes must speak friday eggpotato ratio tortilla needed
ham,Hmm...my uncle just informed me that he's paying the school directly. So pls buy food.,86,2023-01-05 22:00:00,hmmmy uncle informed he paying school directly pls buy food
spam,PRIVATE! Your 2004 Account Statement for 07742676969 shows 786 unredeemed Bonus Points. To claim call 08719180248 Identifier Code: 45239 Expires,144,2023-01-05 23:00:00,private account statement show unredeemed bonus point claim call identifier code expires
spam,"URGENT! Your Mobile No. was awarded å£2000 Bonus Caller Prize on 5/9/03 This is our final try to contact U! Call from Landline 09064019788 BOX42WR29C, 150PPM",157,2023-01-06 00:00:00,urgent mobile awarded bonus caller prize final try contact u call landline boxwrc ppm
ham,here is my new address -apples&pairs&all that malarky,53,2023-01-06 01:00:00,new address applespairsall malarky
spam,Todays Voda numbers ending 7548 are selected to receive a $350 award. If you have a match please call 08712300220 quoting claim code 4041 standard rates app,156,2023-01-06 02:00:00,today voda number ending selected receive award match please call quoting claim code standard rate app
ham,I am going to sao mu today. Will be done only at 12 ,52,2023-01-06 03:00:00,going sao mu today done
ham,ÌÏ predict wat time Ì_'ll finish buying?,40,2023-01-06 04:00:00,predict wat time finish buying
ham,"Good stuff, will do.",20,2023-01-06 05:00:00,good stuff
ham,"Just so that you know,yetunde hasn't sent money yet. I just sent her a text not to bother sending. So its over, you dont have to involve yourself in anything. I shouldn't have imposed anything on you in the first place so for that, i apologise.",244,2023-01-06 06:00:00,knowyetunde hasnt sent money yet sent text bother sending dont involve anything shouldnt imposed anything first place apologise
ham,Are you there in room.,22,2023-01-06 07:00:00,room
ham,HEY GIRL. HOW R U? HOPE U R WELL ME AN DEL R BAK! AGAIN LONG TIME NO C! GIVE ME A CALL SUM TIME FROM LUCYxx,107,2023-01-06 08:00:00,hey girl r u hope u r well del r bak long time c give call sum time lucyxx
ham,K..k:)how much does it cost?,28,2023-01-06 09:00:00,kkhow much cost
ham,I'm home.,9,2023-01-06 10:00:00,im home
ham,"Dear, will call Tmorrow.pls accomodate.",39,2023-01-06 11:00:00,dear call tmorrowpls accomodate
ham,First answer my question.,25,2023-01-06 12:00:00,first answer question
spam,Sunshine Quiz Wkly Q! Win a top Sony DVD player if u know which country the Algarve is in? Txt ansr to 82277. å£1.50 SP:Tyrone,126,2023-01-06 13:00:00,sunshine quiz wkly q win top sony dvd player u know country algarve txt ansr sptyrone
spam,Want 2 get laid tonight? Want real Dogging locations sent direct 2 ur mob? Join the UK's largest Dogging Network bt Txting GRAVEL to 69888! Nt. ec2a. 31p.msg@150p,162,2023-01-06 14:00:00,want get laid tonight want real dogging location sent direct ur mob join uk largest dogging network bt txting gravel nt eca pmsgp
ham,I only haf msn. It's yijue@hotmail.com,38,2023-01-06 15:00:00,haf msn yijuehotmailcom
ham,He is there. You call and meet him,34,2023-01-06 16:00:00,call meet
ham,No no. I will check all rooms befor activities,46,2023-01-06 17:00:00,check room befor activity
spam,You'll not rcv any more msgs from the chat svc. For FREE Hardcore services text GO to: 69988 If u get nothing u must Age Verify with yr network & try again,155,2023-01-06 18:00:00,youll rcv msg chat svc free hardcore service text go u get nothing u must age verify yr network try
ham,Got c... I lazy to type... I forgot Ì_ in lect... I saw a pouch but like not v nice...,86,2023-01-06 19:00:00,got c lazy type forgot lect saw pouch like v nice
ham,"K, text me when you're on the way",33,2023-01-06 20:00:00,k text youre way
ham,"Sir, Waiting for your mail.",27,2023-01-06 21:00:00,sir waiting mail
ham,"A swt thought: \Nver get tired of doing little things 4 lovable persons..\"" Coz..somtimes those little things occupy d biggest part in their Hearts.. Gud ni8""",158,2023-01-06 22:00:00,swt thought nver get tired little thing lovable person cozsomtimes little thing occupy biggest part heart gud ni
ham,I know you are. Can you pls open the back?,42,2023-01-06 23:00:00,know pls open back
ham,Yes see ya not on the dot,25,2023-01-07 00:00:00,yes see ya dot
ham,Whats the staff name who is taking class for us?,48,2023-01-07 01:00:00,whats staff name taking class u
spam,"FreeMsg Why haven't you replied to my text? I'm Randy, sexy, female and live local. Luv to hear from u. Netcollex Ltd 08700621170150p per msg reply Stop to end",159,2023-01-07 02:00:00,freemsg havent replied text im randy sexy female live local luv hear u netcollex ltd p per msg reply stop end
ham,Ummma.will call after check in.our life will begin from qatar so pls pray very hard.,84,2023-01-07 03:00:00,ummmawill call check inour life begin qatar pls pray hard
ham,K..i deleted my contact that why?,33,2023-01-07 04:00:00,ki deleted contact
ham,Sindu got job in birla soft ..,30,2023-01-07 05:00:00,sindu got job birla soft
ham,The wine is flowing and i'm i have nevering..,45,2023-01-07 06:00:00,wine flowing im nevering
ham,Yup i thk cine is better cos no need 2 go down 2 plaza mah.,59,2023-01-07 07:00:00,yup thk cine better co need go plaza mah
