label,text,message_length,timestamp,cleaned_text
spam,"Urgent Urgent! We have 800 FREE flights to Europe to give away, call B4 10th Sept & take a friend 4 FREE. Call now to claim on 09050000555. BA128NNFWFLY150ppm",158,2023-04-23 04:00:00,urgent urgent free flight europe give away call b th sept take friend free call claim bannfwflyppm
ham,All these nice new shirts and the only thing I can wear them to is nudist themed ;_; you in mu?,95,2023-04-23 05:00:00,nice new shirt thing wear nudist themed mu
ham,Hey sexy buns! What of that day? No word from you this morning on YM ... :-( ... I think of you,95,2023-04-23 06:00:00,hey sexy bun day word morning ym think
ham,And whenever you and i see we can still hook up too.,52,2023-04-23 07:00:00,whenever see still hook
ham,Nope but i'm going home now then go pump petrol lor... Like going 2 rain soon...,80,2023-04-23 08:00:00,nope im going home go pump petrol lor like going rain soon
ham,Can you use foreign stamps for whatever you send them off for? ,63,2023-04-23 09:00:00,use foreign stamp whatever send
spam,FROM 88066 LOST å£12 HELP,25,2023-04-23 10:00:00,lost help
ham,Oh baby of the house. How come you dont have any new pictures on facebook,73,2023-04-23 11:00:00,oh baby house come dont new picture facebook
ham,"Feb  &lt;#&gt;  is \I LOVE U\"" day. Send dis to all ur \""VALUED FRNDS\"" evn me. If 3 comes back u'll gt married d person u luv! If u ignore dis u will lose ur luv 4 Evr""",169,2023-04-23 12:00:00,feb ltgt love u day send dis ur valued frnds evn come back ull gt married person u luv u ignore dis u lose ur luv evr
ham,"Hiya, sorry didn't hav signal. I haven't seen or heard from and neither has, which is unusual in itself! I'll put on the case and get him to sort it out! Hugs and snogs.",169,2023-04-23 13:00:00,hiya sorry didnt hav signal havent seen heard neither unusual ill put case get sort hug snogs
ham,"Omw back to tampa from west palm, you hear what happened?",57,2023-04-23 14:00:00,omw back tampa west palm hear happened
ham,Yup no more already... Thanx 4 printing n handing it up.,56,2023-04-23 15:00:00,yup already thanx printing n handing
spam,FreeMsg: Fancy a flirt? Reply DATE now & join the UKs fastest growing mobile dating service. Msgs rcvd just 25p to optout txt stop to 83021. Reply DATE now!,156,2023-04-23 16:00:00,freemsg fancy flirt reply date join uk fastest growing mobile dating service msg rcvd p optout txt stop reply date
ham,What i mean is do they come chase you out when its over or is it stated you can watch as many movies as you want.,113,2023-04-23 17:00:00,mean come chase stated watch many movie want
ham,S now only i took tablets . Reaction morning only.,50,2023-04-23 18:00:00,took tablet reaction morning
spam,Great NEW Offer - DOUBLE Mins & DOUBLE Txt on best Orange tariffs AND get latest camera phones 4 FREE! Call MobileUpd8 free on 08000839402 NOW! or 2stoptxt T&Cs,160,2023-04-23 19:00:00,great new offer double min double txt best orange tariff get latest camera phone free call mobileupd free stoptxt tc
ham,"Nah, I'm a perpetual DD",23,2023-04-23 20:00:00,nah im perpetual dd
ham,Sorry de i went to shop.,24,2023-04-23 21:00:00,sorry de went shop
spam,Hope you enjoyed your new content. text stop to 61610 to unsubscribe. help:08712400602450p Provided by tones2you.co.uk,118,2023-04-23 22:00:00,hope enjoyed new content text stop unsubscribe helpp provided tonesyoucouk
ham,"Wen ur lovable bcums angry wid u, dnt take it seriously.. Coz being angry is d most childish n true way of showing deep affection, care n luv!.. kettoda manda... Have nice day da.",179,2023-04-23 23:00:00,wen ur lovable bcums angry wid u dnt take seriously coz angry childish n true way showing deep affection care n luv kettoda manda nice day da
ham,Hey you still want to go for yogasana? Coz if we end at cine then can go bathe and hav the steam bath,101,2023-04-24 00:00:00,hey still want go yogasana coz end cine go bathe hav steam bath
ham,Nope i'm not drivin... I neva develop da photos lei...,54,2023-04-24 01:00:00,nope im drivin neva develop da photo lei
ham,I am thinking of going down to reg for pract lessons.. Flung my advance.. Haha wat time u going?,96,2023-04-24 02:00:00,thinking going reg pract lesson flung advance haha wat time u going
ham,Cool. I am  &lt;#&gt;  inches long. hope you like them big!,59,2023-04-24 03:00:00,cool ltgt inch long hope like big
ham,"House-Maid is the murderer, coz the man was murdered on  &lt;#&gt; th January.. As public holiday all govt.instituitions are closed,including post office..understand?",166,2023-04-24 04:00:00,housemaid murderer coz man murdered ltgt th january public holiday govtinstituitions closedincluding post officeunderstand
ham,Okie.. Thanx..,14,2023-04-24 05:00:00,okie thanx
spam,18 days to Euro2004 kickoff! U will be kept informed of all the latest news and results daily. Unsubscribe send GET EURO STOP to 83222.,135,2023-04-24 06:00:00,day euro kickoff u kept informed latest news result daily unsubscribe send get euro stop
ham,Go where n buy? Juz buy when we get there lar.,46,2023-04-24 07:00:00,go n buy juz buy get lar
ham,Ok lor...,9,2023-04-24 08:00:00,ok lor
ham,I'm working technical support :)voice process.,46,2023-04-24 09:00:00,im working technical support voice process
ham,It's justbeen overa week since we broke up and already our brains are going to mush!,84,2023-04-24 10:00:00,justbeen overa week since broke already brain going mush
ham,"Tunde, how are you doing. This is just wishing you a great day. Abiola.",71,2023-04-24 11:00:00,tunde wishing great day abiola
ham,Nope... C Ì_ then...,20,2023-04-24 12:00:00,nope c
ham,No. But we'll do medical missions to nigeria,44,2023-04-24 13:00:00,well medical mission nigeria
ham,No i am not having not any movies in my laptop,46,2023-04-24 14:00:00,movie laptop
ham,Whatsup there. Dont u want to sleep,35,2023-04-24 15:00:00,whatsup dont u want sleep
spam,Urgent Please call 09066612661 from landline. å£5000 cash or a luxury 4* Canary Islands Holiday await collection. T&Cs SAE award. 20M12AQ. 150ppm. 16+ ÛÏ,154,2023-04-24 16:00:00,urgent please call landline cash luxury canary island holiday await collection tc sae award maq ppm
spam,"Urgent! Please call 09066612661 from your landline, your complimentary 4* Lux Costa Del Sol holiday or å£1000 CASH await collection. ppm 150 SAE T&Cs James 28, EH74RR",166,2023-04-24 17:00:00,urgent please call landline complimentary lux costa del sol holiday cash await collection ppm sae tc james ehrr
ham,I havent lei.. Next mon can?,28,2023-04-24 18:00:00,havent lei next mon
ham,Mm feeling sleepy. today itself i shall get that dear,53,2023-04-24 19:00:00,mm feeling sleepy today shall get dear
ham,How dare you stupid. I wont tell anything to you. Hear after i wont talk to you:-.,82,2023-04-24 20:00:00,dare stupid wont tell anything hear wont talk
ham,Do Ì_ noe if ben is going?,26,2023-04-24 21:00:00,noe ben going
ham,Can you do a mag meeting this avo at some point?,48,2023-04-24 22:00:00,mag meeting avo point
ham,I meant middle left or right?,29,2023-04-24 23:00:00,meant middle left right
ham,Really? I crashed out cuddled on my sofa.,41,2023-04-25 00:00:00,really crashed cuddled sofa
ham,Hi Chachi tried calling u now unable to reach u .. Pl give me a missed cal once u c tiz msg  Kanagu,99,2023-04-25 01:00:00,hi chachi tried calling u unable reach u pl give missed cal u c tiz msg kanagu
ham,"I sent you the prices and do you mean the  &lt;#&gt; g,",55,2023-04-25 02:00:00,sent price mean ltgt g
ham,Are you this much buzy,22,2023-04-25 03:00:00,much buzy
ham,Nothing. Can...,15,2023-04-25 04:00:00,nothing
spam,I don't know u and u don't know me. Send CHAT to 86688 now and let's find each other! Only 150p/Msg rcvd. HG/Suite342/2Lands/Row/W1J6HL LDN. 18 years or over.,158,2023-04-25 05:00:00,dont know u u dont know send chat let find pmsg rcvd hgsuitelandsrowwjhl ldn year
ham,No * am working on the ringing u thing but have whole houseful of screaming brats so * am pulling my hair out! Loving u,119,2023-04-25 06:00:00,working ringing u thing whole houseful screaming brat pulling hair loving u
ham,But my family not responding for anything. Now am in room not went to home for diwali but no one called me and why not coming. It makes me feel like died.,154,2023-04-25 07:00:00,family responding anything room went home diwali one called coming make feel like died
ham,"Tick, tick, tick ... Babe",25,2023-04-25 08:00:00,tick tick tick babe
ham,R Ì_ going 4 today's meeting?,29,2023-04-25 09:00:00,r going today meeting
ham,K da:)how many page you want?,29,2023-04-25 10:00:00,k dahow many page want
ham,Ya had just now.onion roast.,28,2023-04-25 11:00:00,ya nowonion roast
ham,Send his number and give reply tomorrow morning for why you said that to him like that ok,89,2023-04-25 12:00:00,send number give reply tomorrow morning said like ok
ham,You said not now. No problem. When you can. Let me know.,56,2023-04-25 13:00:00,said problem let know
ham,Ok but tell me half an hr b4 u come i need 2 prepare.,53,2023-04-25 14:00:00,ok tell half hr b u come need prepare
ham,Play w computer? Aiyah i tok 2 u lor?,37,2023-04-25 15:00:00,play w computer aiyah tok u lor
ham,Sat right? Okay thanks... ,26,2023-04-25 16:00:00,sat right okay thanks
ham,"Derp. Which is worse, a dude who always wants to party or a dude who files a complaint about the three drug abusers he lives with",129,2023-04-25 17:00:00,derp worse dude always want party dude file complaint three drug abuser life
ham,Ok Chinese food on its way. When I get fat you're paying for my lipo.,69,2023-04-25 18:00:00,ok chinese food way get fat youre paying lipo
ham,We r outside already.,21,2023-04-25 19:00:00,r outside already
ham,Have a good trip. Watch out for . Remember when you get back we must decide about easter.,89,2023-04-25 20:00:00,good trip watch remember get back must decide easter
ham,Yo we are watching a movie on netflix,37,2023-04-25 21:00:00,yo watching movie netflix
ham,What time. IÛ÷m out until prob 3 or so,39,2023-04-25 22:00:00,time im prob
ham,"Can meh? Thgt some will clash... Really ah, i dun mind... I dun seen to have lost any weight... Gee...",102,2023-04-25 23:00:00,meh thgt clash really ah dun mind dun seen lost weight gee
ham,I dont thnk its a wrong calling between us,42,2023-04-26 00:00:00,dont thnk wrong calling u
ham,I am not sure about night menu. . . I know only about noon menu,63,2023-04-26 01:00:00,sure night menu know noon menu
ham,ARR birthday today:) i wish him to get more oscar.,50,2023-04-26 02:00:00,arr birthday today wish get oscar
ham,"Say this slowly.? GOD,I LOVE YOU &amp; I NEED YOU,CLEAN MY HEART WITH YOUR BLOOD.Send this to Ten special people &amp; u c miracle tomorrow, do it,pls,pls do it...",163,2023-04-26 03:00:00,say slowly godi love amp need youclean heart bloodsend ten special people amp u c miracle tomorrow itplspls
ham,"Open rebtel with firefox. When it loads just put plus sign in the user name place, and it will show you two numbers. The lower number is my number. Once you pick that number the pin will display okay!",200,2023-04-26 04:00:00,open rebtel firefox load put plus sign user name place show two number lower number number pick number pin display okay
ham, and  picking them up from various points,41,2023-04-26 05:00:00,picking various point
spam,Married local women looking for discreet action now! 5 real matches instantly to your phone. Text MATCH to 69969 Msg cost 150p 2 stop txt stop BCMSFWC1N3XX,155,2023-04-26 06:00:00,married local woman looking discreet action real match instantly phone text match msg cost p stop txt stop bcmsfwcnxx
ham,Wow v v impressed. Have funs shopping!,38,2023-04-26 07:00:00,wow v v impressed fun shopping
ham,I am on the way to ur home,26,2023-04-26 08:00:00,way ur home
spam,Burger King - Wanna play footy at a top stadium? Get 2 Burger King before 1st Sept and go Large or Super with Coca-Cola and walk out a winner,141,2023-04-26 09:00:00,burger king wanna play footy top stadium get burger king st sept go large super cocacola walk winner
ham,No problem. Talk to you later,29,2023-04-26 10:00:00,problem talk later
ham,Then ur sis how?,16,2023-04-26 11:00:00,ur si
ham,Still in customer place,23,2023-04-26 12:00:00,still customer place
spam,How come it takes so little time for a child who is afraid of the dark to become a teenager who wants to stay out all night?,124,2023-04-26 13:00:00,come take little time child afraid dark become teenager want stay night
ham,"Dude u knw also telugu..thts gud..k, gud nyt..",46,2023-04-26 14:00:00,dude u knw also teluguthts gudk gud nyt
ham,We confirm eating at esplanade?,31,2023-04-26 15:00:00,confirm eating esplanade
ham,Send me your id and password,28,2023-04-26 16:00:00,send id password
ham,Kind of. Took it to garage. Centre part of exhaust needs replacing. Part ordered n taking it to be fixed tomo morning.,118,2023-04-26 17:00:00,kind took garage centre part exhaust need replacing part ordered n taking fixed tomo morning
spam,"For ur chance to win a å£250 cash every wk TXT: ACTION to 80608. T's&C's www.movietrivia.tv custcare 08712405022, 1x150p/wk.",124,2023-04-26 18:00:00,ur chance win cash every wk txt action tscs wwwmovietriviatv custcare xpwk
ham,Well I might not come then...,29,2023-04-26 19:00:00,well might come
ham,Long after I quit. I get on only like 5 minutes a day as it is.,63,2023-04-26 20:00:00,long quit get like minute day
ham,Then its most likely called Mittelschmertz. Google it. If you dont have paracetamol dont worry it will go.,106,2023-04-26 21:00:00,likely called mittelschmertz google dont paracetamol dont worry go
ham,Well at this right I'm gonna have to get up and check today's steam sales/pee so text me when you want me to come get you,121,2023-04-26 22:00:00,well right im gonna get check today steam salespee text want come get
ham,"Just arrived, see you in a couple days &lt;3",44,2023-04-26 23:00:00,arrived see couple day lt
ham,"K, wat s tht incident?",22,2023-04-27 00:00:00,k wat tht incident
ham,Yeah get the unlimited,22,2023-04-27 01:00:00,yeah get unlimited
ham,cThen i thk shd b enuff.. Still got conclusion n contents pg n references.. I'll b doing da contents pg n cover pg..,116,2023-04-27 02:00:00,cthen thk shd b enuff still got conclusion n content pg n reference ill b da content pg n cover pg
ham,"Forgot it takes me 3 years to shower, sorry. Where you at/your phone dead yet?",78,2023-04-27 03:00:00,forgot take year shower sorry atyour phone dead yet
ham,ÌÏ got wat to buy tell us then Ì_ no need to come in again.,59,2023-04-27 04:00:00,got wat buy tell u need come
ham,When you are big..| God will bring success.,43,2023-04-27 05:00:00,big god bring success
spam,UÛªve Bin Awarded å£50 to Play 4 Instant Cash. Call 08715203028 To Claim. EVERY 9th Player Wins Min å£50-å£500. OptOut 08718727870,131,2023-04-27 06:00:00,uve bin awarded play instant cash call claim every th player win min optout
ham,"Û_ we r stayin here an extra week, back next wed. How did we do in the rugby this weekend? Hi to and and , c u soon \""ham""",124,2023-04-27 07:00:00,r stayin extra week back next wed rugby weekend hi c u soon ham
ham,Not from this campus. Are you in the library?,45,2023-04-27 08:00:00,campus library
ham,"The affidavit says  &lt;#&gt;  E Twiggs St, division g, courtroom  &lt;#&gt; , &lt;TIME&gt;  AM. I'll double check and text you again tomorrow",142,2023-04-27 09:00:00,affidavit say ltgt e twiggs st division g courtroom ltgt lttimegt ill double check text tomorrow
ham,How will I creep on you now? ;_;,32,2023-04-27 10:00:00,creep
ham,Tell your friends what you plan to do on Valentines day @ &lt;URL&gt;,69,2023-04-27 11:00:00,tell friend plan valentine day lturlgt
ham,If I get there before you after your ten billion calls and texts so help me god,79,2023-04-27 12:00:00,get ten billion call text help god
ham,Purity of friendship between two is not about smiling after reading the forwarded message..Its about smiling just by seeing the name. Gud evng musthu,149,2023-04-27 13:00:00,purity friendship two smiling reading forwarded messageits smiling seeing name gud evng musthu
ham,I've told him that i've returned it. That should i re order it.,63,2023-04-27 14:00:00,ive told ive returned order
ham,"House-Maid is the murderer, coz the man was murdered on  &lt;#&gt; th January.. As public holiday all govt.instituitions are closed,including post office..",155,2023-04-27 15:00:00,housemaid murderer coz man murdered ltgt th january public holiday govtinstituitions closedincluding post office
ham,Depends on where u going lor.,29,2023-04-27 16:00:00,depends u going lor
ham,And smile for me right now as you go and the world will wonder what you are smiling about and think your crazy and keep away from you ... *grins*,145,2023-04-27 17:00:00,smile right go world wonder smiling think crazy keep away grin
spam,FreeMsg>FAV XMAS TONES!Reply REAL,33,2023-04-27 18:00:00,freemsgfav xmas tonesreply real
ham,Lil fever:) now fine:),22,2023-04-27 19:00:00,lil fever fine
ham,I think it's all still in my car,32,2023-04-27 20:00:00,think still car
ham,Can a not?,10,2023-04-27 21:00:00,
spam,December only! Had your mobile 11mths+? You are entitled to update to the latest colour camera mobile for Free! Call The Mobile Update Co FREE on 08002986906 ,158,2023-04-27 22:00:00,december mobile mths entitled update latest colour camera mobile free call mobile update co free
ham,Yes princess! I want to catch you with my big strong hands...,61,2023-04-27 23:00:00,yes princess want catch big strong hand
ham,Oh yeah I forgot. U can only take 2 out shopping at once.,57,2023-04-28 00:00:00,oh yeah forgot u take shopping
ham,Mm so you asked me not to call radio,36,2023-04-28 01:00:00,mm asked call radio
ham,Thinkin about someone is all good. No drugs for that,52,2023-04-28 02:00:00,thinkin someone good drug
ham,"Say this slowly.? GOD,I LOVE YOU &amp; I NEED YOU,CLEAN MY HEART WITH YOUR BLOOD.Send this to Ten special people &amp; u c miracle tomorrow, do it,pls,pls do it...",163,2023-04-28 03:00:00,say slowly godi love amp need youclean heart bloodsend ten special people amp u c miracle tomorrow itplspls
ham,"Enjoy the showers of possessiveness poured on u by ur loved ones, bcoz in this world of lies, it is a golden gift to be loved truly..",133,2023-04-28 04:00:00,enjoy shower possessiveness poured u ur loved one bcoz world lie golden gift loved truly
ham,"Alright if you're sure, let me know when you're leaving",55,2023-04-28 05:00:00,alright youre sure let know youre leaving
ham,Some are lasting as much as 2 hours. You might get lucky.,57,2023-04-28 06:00:00,lasting much hour might get lucky
ham,Genius what's up. How your brother. Pls send his number to my skype.,68,2023-04-28 07:00:00,genius whats brother pls send number skype
spam,"Gr8 Poly tones 4 ALL mobs direct 2u rply with POLY TITLE to 8007 eg POLY BREATHE1 Titles: CRAZYIN, SLEEPINGWITH, FINEST, YMCA :getzed.co.uk POBox365O4W45WQ 300p",160,2023-04-28 08:00:00,gr poly tone mob direct u rply poly title eg poly breathe title crazyin sleepingwith finest ymca getzedcouk poboxowwq p
ham,Thk some of em find wtc too far... Weiyi not goin... E rest i dunno yet... R ur goin 4 dinner den i might b able to join...,123,2023-04-28 09:00:00,thk em find wtc far weiyi goin e rest dunno yet r ur goin dinner den might b able join
ham,Don't forget who owns you and who's private property you are ... And be my good boy always .. *passionate kiss*,111,2023-04-28 10:00:00,dont forget owns who private property good boy always passionate kiss
spam,INTERFLORA - åÒIt's not too late to order Interflora flowers for christmas call 0800 505060 to place your order before Midnight tomorrow.,137,2023-04-28 11:00:00,interflora late order interflora flower christmas call place order midnight tomorrow
ham,Oh god..taken the teeth?is it paining,37,2023-04-28 12:00:00,oh godtaken teethis paining
spam,ROMCAPspam Everyone around should be responding well to your presence since you are so warm and outgoing. You are bringing in a real breath of sunshine.,152,2023-04-28 13:00:00,romcapspam everyone around responding well presence since warm outgoing bringing real breath sunshine
ham,Then u ask darren go n pick u lor... But i oso sian tmr haf 2 meet lect...,74,2023-04-28 14:00:00,u ask darren go n pick u lor oso sian tmr haf meet lect
ham,No need to buy lunch for me.. I eat maggi mee..,47,2023-04-28 15:00:00,need buy lunch eat maggi mee
spam,"Congratulations - Thanks to a good friend U have WON the å£2,000 Xmas prize. 2 claim is easy, just call 08712103738 NOW! Only 10p per minute. BT-national-rate",158,2023-04-28 16:00:00,congratulation thanks good friend u xmas prize claim easy call p per minute btnationalrate
ham,Ok lor...,9,2023-04-28 17:00:00,ok lor
ham,"Oh right, ok. I'll make sure that i do loads of work during the day!  got a really nasty cough today and is dry n shot so that should really help it!",149,2023-04-28 18:00:00,oh right ok ill make sure load work day got really nasty cough today dry n shot really help
ham,Wife.how she knew the time of murder exactly,44,2023-04-28 19:00:00,wifehow knew time murder exactly
spam,Send a logo 2 ur lover - 2 names joined by a heart. Txt LOVE NAME1 NAME2 MOBNO eg LOVE ADAM EVE 07123456789 to 87077 Yahoo! POBox36504W45WQ TxtNO 4 no ads 150p.,160,2023-04-28 20:00:00,send logo ur lover name joined heart txt love name name mobno eg love adam eve yahoo poboxwwq txtno ad p
ham,Howz that persons story,23,2023-04-28 21:00:00,howz person story
ham,Thanx 4 sending me home...,26,2023-04-28 22:00:00,thanx sending home
ham,Its normally hot mail. Com you see!,35,2023-04-28 23:00:00,normally hot mail com see
spam,"You've won tkts to the EURO2004 CUP FINAL or å£800 CASH, to collect CALL 09058099801 b4190604, POBOX 7876150ppm",111,2023-04-29 00:00:00,youve tkts euro cup final cash collect call b pobox ppm
ham,U sick still can go shopping?,29,2023-04-29 01:00:00,u sick still go shopping
ham,"Ya they are well and fine., BBD(pooja) full pimples..even she become quite black..and ur rite here its too cold, wearing sweatter..",131,2023-04-29 02:00:00,ya well fine bbdpooja full pimpleseven become quite blackand ur rite cold wearing sweatter
ham,Nice.nice.how is it working?,28,2023-04-29 03:00:00,nicenicehow working
ham,1's reach home call me.,23,2023-04-29 04:00:00,reach home call
ham,Were trying to find a Chinese food place around here,52,2023-04-29 05:00:00,trying find chinese food place around
ham,"Easy mate, * guess the quick drink was bit ambitious.",53,2023-04-29 06:00:00,easy mate guess quick drink bit ambitious
ham,BABE !!! I miiiiiiissssssssss you ! I need you !!! I crave you !!! :-( ... Geeee ... I'm so sad without you babe ... I love you ...,131,2023-04-29 07:00:00,babe miiiiiiissssssssss need crave geeee im sad without babe love
ham,Ok thanx...,11,2023-04-29 08:00:00,ok thanx
ham,aathi..where are you dear..,27,2023-04-29 09:00:00,aathiwhere dear
ham,"Tunji, how's the queen? how are you doing. This is just wishing you a great day. Abiola.",88,2023-04-29 10:00:00,tunji hows queen wishing great day abiola
ham,Today iZ Yellow rose day. If u love my frndship give me 1 misscall &amp; send this to ur frndZ &amp; See how many miss calls u get. If u get 6missed U marry ur Lover.,166,2023-04-29 11:00:00,today iz yellow rose day u love frndship give misscall amp send ur frndz amp see many miss call u get u get missed u marry ur lover
ham,Will be out of class in a few hours. Sorry,42,2023-04-29 12:00:00,class hour sorry
ham,Wat time u finish ur lect today?,32,2023-04-29 13:00:00,wat time u finish ur lect today
spam,"Free-message: Jamster!Get the crazy frog sound now! For poly text MAD1, for real text MAD2 to 88888. 6 crazy sounds for just 3 GBP/week! 16+only! T&C's apply",157,2023-04-29 14:00:00,freemessage jamsterget crazy frog sound poly text mad real text mad crazy sound gbpweek tc apply
ham,"Sad story of a Man - Last week was my b'day. My Wife did'nt wish me. My Parents forgot n so did my Kids . I went to work. Even my Colleagues did not wish. As I entered my cabin my PA said, '' Happy B'day Boss !!''. I felt special. She askd me 4 lunch. After lunch she invited me to her apartment. We went there. She said,'' do u mind if I go into the bedroom for a minute ? '' ''OK'', I sed in a sexy mood. She came out 5 minuts latr wid a cake...n My Wife, My Parents, My Kidz, My Friends n My Colleagues. All screaming.. SURPRISE !! and I was waiting on the sofa.. ... ..... ' NAKED...!",588,2023-04-29 15:00:00,sad story man last week bday wife didnt wish parent forgot n kid went work even colleague wish entered cabin pa said happy bday bos felt special askd lunch lunch invited apartment went said u mind go bedroom minute ok sed sexy mood came minuts latr wid caken wife parent kidz friend n colleague screaming surprise waiting sofa naked
spam,"YOUR CHANCE TO BE ON A REALITY FANTASY SHOW call now = 08707509020 Just 20p per min NTT Ltd, PO Box 1327 Croydon CR9 5WB 0870 is a national = rate call",151,2023-04-29 16:00:00,chance reality fantasy show call p per min ntt ltd po box croydon cr wb national rate call
ham,She's fine. Good to hear from you. How are you my dear? Happy new year oh.,74,2023-04-29 17:00:00,shes fine good hear dear happy new year oh
ham,Are you going to wipro interview today?,39,2023-04-29 18:00:00,going wipro interview today
ham,how tall are you princess?,26,2023-04-29 19:00:00,tall princess
ham,I doubt you could handle 5 times per night in any case...,57,2023-04-29 20:00:00,doubt could handle time per night case
ham,Haha... Hope Ì_ can hear the receipt sound... Gd luck!,54,2023-04-29 21:00:00,haha hope hear receipt sound gd luck
