label,text,message_length,timestamp,cleaned_text
spam,Want a new Video Phone? 750 anytime any network mins? Half price line rental free text for 3 months? Reply or call 08000930705 for free delivery,144,2023-06-23 02:00:00,want new video phone anytime network min half price line rental free text month reply call free delivery
ham,"Yo, call me when you get the chance, a friend of mine wanted me to ask you about a big order",92,2023-06-23 03:00:00,yo call get chance friend mine wanted ask big order
ham,This single single answers are we fighting? Plus i said am broke and you didnt reply,84,2023-06-23 04:00:00,single single answer fighting plus said broke didnt reply
ham,It certainly puts things into perspective when something like this happens,74,2023-06-23 05:00:00,certainly put thing perspective something like happens
ham,Now got tv 2 watch meh? U no work today?,40,2023-06-23 06:00:00,got tv watch meh u work today
ham,i felt so...not any conveying reason.. Ese he... What about me?,63,2023-06-23 07:00:00,felt sonot conveying reason ese
spam,Had your mobile 11 months or more? U R entitled to Update to the latest colour mobiles with camera for Free! Call The Mobile Update Co FREE on 08002986030,154,2023-06-23 08:00:00,mobile month u r entitled update latest colour mobile camera free call mobile update co free
ham,How's it going? Got any exciting karaoke type activities planned? I'm debating whether to play football this eve. Feeling lazy though.,134,2023-06-23 09:00:00,hows going got exciting karaoke type activity planned im debating whether play football eve feeling lazy though
ham,I told that am coming on wednesday.,35,2023-06-23 10:00:00,told coming wednesday
ham,"Its ok, called mom instead have fun",35,2023-06-23 11:00:00,ok called mom instead fun
spam,"Dear Voucher Holder, To claim this weeks offer, at your PC please go to http://www.wtlp.co.uk/text. Ts&Cs apply.",112,2023-06-23 12:00:00,dear voucher holder claim week offer pc please go httpwwwwtlpcouktext tscs apply
ham,Well if I'm that desperate I'll just call armand again,54,2023-06-23 13:00:00,well im desperate ill call armand
ham,Are you at work right now ?,27,2023-06-23 14:00:00,work right
spam,Congrats! Nokia 3650 video camera phone is your Call 09066382422 Calls cost 150ppm Ave call 3mins vary from mobiles 16+ Close 300603 post BCM4284 Ldn WC1N3XX,157,2023-06-23 15:00:00,congrats nokia video camera phone call call cost ppm ave call min vary mobile close post bcm ldn wcnxx
ham,Haven't heard anything and he's not answering my texts so I'm guessing he flaked. That said the jb is fantastic,111,2023-06-23 16:00:00,havent heard anything he answering text im guessing flaked said jb fantastic
ham,"Mmmmmm ... I love you,so much, Ahmad ... I can't wait for this year to begin as every second takes me closer to being at your side. Happy New Year, my love!!",157,2023-06-23 17:00:00,mmmmmm love youso much ahmad cant wait year begin every second take closer side happy new year love
ham,Pls what's the full name of joke's school cos fees in university of florida seem to actually be  &lt;#&gt; k. Pls holla back,124,2023-06-23 18:00:00,pls whats full name joke school co fee university florida seem actually ltgt k pls holla back
ham,"Sorry, I'll call later",22,2023-06-23 19:00:00,sorry ill call later
ham,Ok... But they said i've got wisdom teeth hidden inside n mayb need 2 remove.,77,2023-06-23 20:00:00,ok said ive got wisdom teeth hidden inside n mayb need remove
ham,And pls pls drink plenty plenty water,37,2023-06-23 21:00:00,pls pls drink plenty plenty water
ham,How are you doing. How's the queen. Are you going for the royal wedding,71,2023-06-23 22:00:00,hows queen going royal wedding
ham,He's in lag. That's just the sad part but we keep in touch thanks to skype,74,2023-06-23 23:00:00,he lag thats sad part keep touch thanks skype
ham,Ok lor then we go tog lor...,28,2023-06-24 00:00:00,ok lor go tog lor
ham,Two teams waiting for some players,34,2023-06-24 01:00:00,two team waiting player
ham,Can Ì_ send me a copy of da report?,35,2023-06-24 02:00:00,send copy da report
ham,"swhrt how u dey,hope ur ok, tot about u 2day.love n miss.take care.",67,2023-06-24 03:00:00,swhrt u deyhope ur ok tot u daylove n misstake care
ham,"Ok da, i already planned. I wil pick you.",41,2023-06-24 04:00:00,ok da already planned wil pick
spam,"Urgent! Please call 0906346330. Your ABTA complimentary 4* Spanish Holiday or å£10,000 cash await collection SAE T&Cs BOX 47 PO19 2EZ 150ppm 18+",144,2023-06-24 05:00:00,urgent please call abta complimentary spanish holiday cash await collection sae tc box po ez ppm
ham,"Sorry, I'll call later in meeting",33,2023-06-24 06:00:00,sorry ill call later meeting
ham,I just really need shit before tomorrow and I know you won't be awake before like 6,83,2023-06-24 07:00:00,really need shit tomorrow know wont awake like
ham,I'm good. Have you registered to vote?,38,2023-06-24 08:00:00,im good registered vote
ham,"Hmm ok, i'll stay for like an hour cos my eye is really sore!",61,2023-06-24 09:00:00,hmm ok ill stay like hour co eye really sore
ham,Dear got bus directly to calicut,32,2023-06-24 10:00:00,dear got bus directly calicut
ham,Mm umma ask vava also to come tell him can play later together,62,2023-06-24 11:00:00,mm umma ask vava also come tell play later together
ham,"Well the general price is  &lt;#&gt; /oz, let me know if/when/how much you want",79,2023-06-24 12:00:00,well general price ltgt oz let know ifwhenhow much want
ham,"Sorry, I'll call later",22,2023-06-24 13:00:00,sorry ill call later
ham,"Each Moment in a day,has its own value-Morning brings hope,afternoon brings faith,Evening brings luv,Night brings rest,Wish u find them all today.Good Morning",158,2023-06-24 14:00:00,moment dayhas valuemorning brings hopeafternoon brings faithevening brings luvnight brings restwish u find todaygood morning
ham,&lt;#&gt;  w jetton ave if you forgot,37,2023-06-24 15:00:00,ltgt w jetton ave forgot
ham,Ok i'm coming home now.,23,2023-06-24 16:00:00,ok im coming home
ham,Can not use foreign stamps in this country.,43,2023-06-24 17:00:00,use foreign stamp country
spam,"Double mins and txts 4 6months FREE Bluetooth on Orange. Available on Sony, Nokia Motorola phones. Call MobileUpd8 on 08000839402 or call2optout/N9DX",149,2023-06-24 18:00:00,double min txts month free bluetooth orange available sony nokia motorola phone call mobileupd calloptoutndx
ham,"Sorry, it's a lot of friend-of-a-friend stuff, I'm just now about to talk to the actual guy who wants to buy",108,2023-06-24 19:00:00,sorry lot friendofafriend stuff im talk actual guy want buy
spam,FREE for 1st week! No1 Nokia tone 4 ur mob every week just txt NOKIA to 8007 Get txting and tell ur mates www.getzed.co.uk POBox 36504 W45WQ norm150p/tone 16+,158,2023-06-24 20:00:00,free st week nokia tone ur mob every week txt nokia get txting tell ur mate wwwgetzedcouk pobox wwq normptone
spam,"Want to funk up ur fone with a weekly new tone reply TONES2U 2 this text. www.ringtones.co.uk, the original n best. Tones 3GBP network operator rates apply",155,2023-06-24 21:00:00,want funk ur fone weekly new tone reply tonesu text wwwringtonescouk original n best tone gbp network operator rate apply
spam,"cmon babe, make me horny, *turn* me on! Txt me your fantasy now babe -) Im hot, sticky and need you now. All replies cost å£1.50. 2 cancel send STOP",148,2023-06-24 22:00:00,cmon babe make horny turn txt fantasy babe im hot sticky need reply cost cancel send stop
ham,I will come tomorrow di,23,2023-06-24 23:00:00,come tomorrow di
ham,Wylie update: my weed dealer carlos went to freedom and had a class with lunsford,81,2023-06-25 00:00:00,wylie update weed dealer carlos went freedom class lunsford
ham,Are you happy baby ? Are you alright ? Did you take that job ? I hope your fine. I send you a kiss to make you smile from across the sea ... *kiss* *kiss*,154,2023-06-25 01:00:00,happy baby alright take job hope fine send kiss make smile across sea kiss kiss
ham,C movie is juz last minute decision mah. Juz watch 2 lar but i tot Ì_ not interested.,85,2023-06-25 02:00:00,c movie juz last minute decision mah juz watch lar tot interested
ham,How are you enjoying this semester? Take care brother.,54,2023-06-25 03:00:00,enjoying semester take care brother
spam,IMPORTANT INFORMATION 4 ORANGE USER 0796XXXXXX. TODAY IS UR LUCKY DAY!2 FIND OUT WHY LOG ONTO http://www.urawinner.com THERE'S A FANTASTIC PRIZEAWAITING YOU!,157,2023-06-25 04:00:00,important information orange user xxxxxx today ur lucky day find log onto httpwwwurawinnercom there fantastic prizeawaiting
ham,"Get the door, I'm here",22,2023-06-25 05:00:00,get door im
ham,"Lets use it next week, princess :)",34,2023-06-25 06:00:00,let use next week princess
ham,Or i go home first lar Ì_ wait 4 me lor.. I put down my stuff first..,69,2023-06-25 07:00:00,go home first lar wait lor put stuff first
ham,I want kfc its Tuesday. Only buy 2 meals ONLY 2. No gravy. Only 2 Mark. 2!,74,2023-06-25 08:00:00,want kfc tuesday buy meal gravy mark
ham,No da:)he is stupid da..always sending like this:)don believe any of those message.pandy is a mental:),102,2023-06-25 09:00:00,dahe stupid daalways sending like thisdon believe messagepandy mental
ham,Oi when you gonna ring,22,2023-06-25 10:00:00,oi gonna ring
spam,Missed call alert. These numbers called but left no message. 07008009200,72,2023-06-25 11:00:00,missed call alert number called left message
ham,I attended but nothing is there.,32,2023-06-25 12:00:00,attended nothing
ham,Ard 530 like dat lor. We juz meet in mrt station then Ì_ dun haf to come out.,77,2023-06-25 13:00:00,ard like dat lor juz meet mrt station dun haf come
ham,No dear i was sleeping :-P,26,2023-06-25 14:00:00,dear sleeping p
ham,Er mw im filled tuth is aight,29,2023-06-25 15:00:00,er mw im filled tuth aight
ham,Will be office around 4 pm. Now i am going hospital.,52,2023-06-25 16:00:00,office around pm going hospital
ham,Actually i'm waiting for 2 weeks when they start putting ad.,60,2023-06-25 17:00:00,actually im waiting week start putting ad
ham,Anything lor if they all go then i go lor...,44,2023-06-25 18:00:00,anything lor go go lor
ham,U free on sat rite? U wan 2 watch infernal affairs wif me n darren n mayb xy?,77,2023-06-25 19:00:00,u free sat rite u wan watch infernal affair wif n darren n mayb xy
ham,"Plz note: if anyone calling from a mobile Co. &amp; asks u to type # &lt;#&gt;  or # &lt;#&gt; . Do not do so. Disconnect the call,coz it iz an attempt of 'terrorist' to make use of the sim card no. Itz confirmd by nokia n motorola n has been verified by CNN IBN.",263,2023-06-25 20:00:00,plz note anyone calling mobile co amp asks u type ltgt ltgt disconnect callcoz iz attempt terrorist make use sim card itz confirmd nokia n motorola n verified cnn ibn
ham,Yo you around? A friend of mine's lookin to pick up later tonight,65,2023-06-25 21:00:00,yo around friend mine lookin pick later tonight
ham,Stupid auto correct on my phone,31,2023-06-25 22:00:00,stupid auto correct phone
ham,Double eviction this week - Spiral and Michael and good riddance to them!,73,2023-06-25 23:00:00,double eviction week spiral michael good riddance
ham,"\The world suffers a lot... Not because of the violence of bad people. But because of the silence of good people!\""",115,2023-06-26 00:00:00,world suffers lot violence bad people silence good people
ham,"Ok thats cool. Its , just off either raglan rd or edward rd. Behind the cricket ground. Gimme ring when ur closeby see you tuesday.",131,2023-06-26 01:00:00,ok thats cool either raglan rd edward rd behind cricket ground gimme ring ur closeby see tuesday
ham,Buy one egg for me da..please:),31,2023-06-26 02:00:00,buy one egg daplease
ham,Have you started in skye,24,2023-06-26 03:00:00,started skye
ham,Have you bookedthe hut? And also your time off? How are you by the way?,71,2023-06-26 04:00:00,bookedthe hut also time way
ham,And several to you sir.,23,2023-06-26 05:00:00,several sir
ham,U really pig leh sleep so much. My dad wake me up at 10 smth 2 eat lunch today.,79,2023-06-26 06:00:00,u really pig leh sleep much dad wake smth eat lunch today
ham,I'm at home. Please call,24,2023-06-26 07:00:00,im home please call
ham,My love ... I hope your not doing anything drastic. Don't you dare sell your pc or your phone ...,97,2023-06-26 08:00:00,love hope anything drastic dont dare sell pc phone
ham,Now only i reached home. . . I am very tired now. . I will come tomorro,71,2023-06-26 09:00:00,reached home tired come tomorro
spam,FREEMSG: Our records indicate you may be entitled to 3750 pounds for the Accident you had. To claim for free reply with YES to this msg. To opt out text STOP,157,2023-06-26 10:00:00,freemsg record indicate may entitled pound accident claim free reply yes msg opt text stop
spam,"U can WIN å£100 of Music Gift Vouchers every week starting NOW Txt the word DRAW to 87066 TsCs www.Idew.com SkillGame, 1Winaweek, age16. 150ppermessSubscription",160,2023-06-26 11:00:00,u win music gift voucher every week starting txt word draw tscs wwwidewcom skillgame winaweek age ppermesssubscription
ham,Life style garments account no please.,38,2023-06-26 12:00:00,life style garment account please
ham,Lol wtf random. Btw is that your lunch break,44,2023-06-26 13:00:00,lol wtf random btw lunch break
ham,"Sez, hows u & de arab boy? Hope u r all good give my love 2 evry1 love ya eshxxxxxxxxxxx",88,2023-06-26 14:00:00,sez hows u de arab boy hope u r good give love evry love ya eshxxxxxxxxxxx
ham,"The LAY MAN! Just to let you know you are missed and thought off. Do have a great day. And if you can send me bimbo and ugo's numbers, ill appreciate. Safe",155,2023-06-26 15:00:00,lay man let know missed thought great day send bimbo ugos number ill appreciate safe
ham,Detroit. The home of snow. Enjoy it.,36,2023-06-26 16:00:00,detroit home snow enjoy
spam,Show ur colours! Euro 2004 2-4-1 Offer! Get an England Flag & 3Lions tone on ur phone! Click on the following service message for info!,135,2023-06-26 17:00:00,show ur colour euro offer get england flag lion tone ur phone click following service message info
ham,Okie...,7,2023-06-26 18:00:00,okie
ham,"Aight, I'm chillin in a friend's room so text me when you're on the way",71,2023-06-26 19:00:00,aight im chillin friend room text youre way
ham,Is toshiba portege m100 gd?,27,2023-06-26 20:00:00,toshiba portege gd
ham,Well welp is sort of a semiobscure internet thing,49,2023-06-26 21:00:00,well welp sort semiobscure internet thing
spam,Text PASS to 69669 to collect your polyphonic ringtones. Normal gprs charges apply only. Enjoy your tones,105,2023-06-26 22:00:00,text pas collect polyphonic ringtones normal gprs charge apply enjoy tone
spam,"accordingly. I repeat, just text the word ok on your mobile phone and send",74,2023-06-26 23:00:00,accordingly repeat text word ok mobile phone send
ham,Loosu go to hospital. De dont let it careless.,46,2023-06-27 00:00:00,loosu go hospital de dont let careless
ham,How much for an eighth?,23,2023-06-27 01:00:00,much eighth
ham,Omg Joanna is freaking me out. She's looked thru all my friends to find photos of me. And then she's asking about stuff on my MySpace which I haven't even logged on in like a year. :/,183,2023-06-27 02:00:00,omg joanna freaking shes looked thru friend find photo shes asking stuff myspace havent even logged like year
ham,"Send ur birthdate with month and year, I will tel u ur LIFE PARTNER'S name. and the method of calculation. Reply must.",118,2023-06-27 03:00:00,send ur birthdate month year tel u ur life partner name method calculation reply must
ham,Juz now havent woke up so a bit blur blur... Can? Dad went out liao... I cant cum now oso...,92,2023-06-27 04:00:00,juz havent woke bit blur blur dad went liao cant cum oso
ham,"How about clothes, jewelry, and trips?",38,2023-06-27 05:00:00,clothes jewelry trip
spam,Block Breaker now comes in deluxe format with new features and great graphics from T-Mobile. Buy for just å£5 by replying GET BBDELUXE and take the challenge,157,2023-06-27 06:00:00,block breaker come deluxe format new feature great graphic tmobile buy replying get bbdeluxe take challenge
ham,Aah! A cuddle would be lush! I'd need lots of tea and soup before any kind of fumbling!,87,2023-06-27 07:00:00,aah cuddle would lush id need lot tea soup kind fumbling
spam,important information 4 orange user . today is your lucky day!2find out why log onto http://www.urawinner.com THERE'S A FANTASTIC SURPRISE AWAITING YOU!,152,2023-06-27 08:00:00,important information orange user today lucky dayfind log onto httpwwwurawinnercom there fantastic surprise awaiting
ham,I am late. I will be there at,29,2023-06-27 09:00:00,late
ham,Sad story of a Man - Last week was my b'day. My Wife did'nt wish me. My Parents forgot n so did my Kids . I went to work. Even my Colleagues did not wish.,154,2023-06-27 10:00:00,sad story man last week bday wife didnt wish parent forgot n kid went work even colleague wish
ham,Are you plans with your family set in stone ?,45,2023-06-27 11:00:00,plan family set stone
ham,Pls dont forget to study,24,2023-06-27 12:00:00,pls dont forget study
ham,You'll never believe this but i have actually got off at taunton. Wow,69,2023-06-27 13:00:00,youll never believe actually got taunton wow
ham,"Den only weekdays got special price... Haiz... Cant eat liao... Cut nails oso muz wait until i finish drivin wat, lunch still muz eat wat... ",141,2023-06-27 14:00:00,den weekday got special price haiz cant eat liao cut nail oso muz wait finish drivin wat lunch still muz eat wat
ham,She just broke down a list of reasons why nobody's in town and I can't tell if she's being sarcastic or just faggy,114,2023-06-27 15:00:00,broke list reason nobody town cant tell shes sarcastic faggy
ham, &lt;DECIMAL&gt; m but its not a common car here so its better to buy from china or asia. Or if i find it less expensive. I.ll holla,132,2023-06-27 16:00:00,ltdecimalgt common car better buy china asia find le expensive ill holla
ham,The greatest test of courage on earth is to bear defeat without losing heart....gn tc,85,2023-06-27 17:00:00,greatest test courage earth bear defeat without losing heartgn tc
ham,SORRY IM STIL FUCKED AFTER LAST NITE WENT TOBED AT 430 GOT UP 4 WORK AT 630,75,2023-06-27 18:00:00,sorry im stil fucked last nite went tobed got work
ham,Hey so whats the plan this sat? ,32,2023-06-27 19:00:00,hey whats plan sat
ham,Beauty sleep can help ur pimples too.,37,2023-06-27 20:00:00,beauty sleep help ur pimple
ham,Great. Hope you are using your connections from mode men also cos you can never know why old friends can lead you to today,122,2023-06-27 21:00:00,great hope using connection mode men also co never know old friend lead today
spam,Natalja (25/F) is inviting you to be her friend. Reply YES-440 or NO-440 See her: www.SMS.ac/u/nat27081980 STOP? Send STOP FRND to 62468,136,2023-06-27 22:00:00,natalja f inviting friend reply yes see wwwsmsacunat stop send stop frnd
ham,Where to get those?,19,2023-06-27 23:00:00,get
ham,"Kind of. Just missed train cos of asthma attack, nxt one in half hr so driving in. not sure where to park.",106,2023-06-28 00:00:00,kind missed train co asthma attack nxt one half hr driving sure park
ham,Ball is moving a lot.will spin in last :)so very difficult to bat:),67,2023-06-28 01:00:00,ball moving lotwill spin last difficult bat
ham,Haiyoh... Maybe your hamster was jealous of million,51,2023-06-28 02:00:00,haiyoh maybe hamster jealous million
ham,Can you please send me my aunty's number,40,2023-06-28 03:00:00,please send aunty number
ham,I'm glad. You are following your dreams.,40,2023-06-28 04:00:00,im glad following dream
ham,I've reached home finally...,28,2023-06-28 05:00:00,ive reached home finally
spam,"URGENT. Important information for 02 user. Today is your lucky day! 2 find out why , log onto http://www.urawinner.com there is a fantastic surprise awaiting you !",163,2023-06-28 06:00:00,urgent important information user today lucky day find log onto httpwwwurawinnercom fantastic surprise awaiting
spam,WINNER!! As a valued network customer you have been selected to receivea å£900 prize reward! To claim call 09061701461. Claim code KL341. Valid 12 hours only.,158,2023-06-28 07:00:00,winner valued network customer selected receivea prize reward claim call claim code kl valid hour
ham,"Wn u r hurt by d prsn who s close 2 u, do fight wit dem. Coz somtimes dis fight saves a relation bt being quiet leaves nothin in a relation.. Gud eveB-)",152,2023-06-28 08:00:00,wn u r hurt prsn close u fight wit dem coz somtimes dis fight save relation bt quiet leaf nothin relation gud eveb
ham,U can call now...,17,2023-06-28 09:00:00,u call
ham,"Science tells that chocolate will melt under the sunlight. Please don't walk under the sunlight. BCoz,I don't want to loss a sweet friend.",138,2023-06-28 10:00:00,science tell chocolate melt sunlight please dont walk sunlight bcozi dont want loss sweet friend
ham,Yes. I come to nyc for audiitions and am trying to relocate.,60,2023-06-28 11:00:00,yes come nyc audiitions trying relocate
ham,I pocked you up there before,28,2023-06-28 12:00:00,pocked
ham,Congrats. That's great. I wanted to tell you not to tell me your score cos it might make me relax. But its motivating me so thanks for sharing,142,2023-06-28 13:00:00,congrats thats great wanted tell tell score co might make relax motivating thanks sharing
ham,I wud never mind if u dont miss me or if u dont need me.. But u wil really hurt me wen u need me &amp; u dont tell me......... Take care:-),139,2023-06-28 14:00:00,wud never mind u dont miss u dont need u wil really hurt wen u need amp u dont tell take care
ham,Hey mr whats the name of that bill brison book the one about language and words ,80,2023-06-28 15:00:00,hey mr whats name bill brison book one language word
ham,"Okay, good, no problem, and thanx!",34,2023-06-28 16:00:00,okay good problem thanx
ham,"For you information, IKEA is spelled with all caps. That is not yelling. when you thought i had left you, you were sitting on the bed among the mess when i came in. i said we were going after you got home from class. please don't try and bullshit me. It makes me want to listen to you less.",290,2023-06-28 17:00:00,information ikea spelled cap yelling thought left sitting bed among mess came said going got home class please dont try bullshit make want listen le
ham,Call me when u're done...,25,2023-06-28 18:00:00,call ure done
ham,G.W.R,5,2023-06-28 19:00:00,gwr
ham,You best watch what you say cause I get drunk as a motherfucker,63,2023-06-28 20:00:00,best watch say cause get drunk motherfucker
spam,Kit Strip - you have been billed 150p. Netcollex Ltd. PO Box 1013 IG11 OJA,74,2023-06-28 21:00:00,kit strip billed p netcollex ltd po box ig oja
spam,HMV BONUS SPECIAL 500 pounds of genuine HMV vouchers to be won. Just answer 4 easy questions. Play Now! Send HMV to 86688 More info:www.100percent-real.com,155,2023-06-28 22:00:00,hmv bonus special pound genuine hmv voucher answer easy question play send hmv infowwwpercentrealcom
spam,Please CALL 08712402578 immediately as there is an urgent message waiting for you,81,2023-06-28 23:00:00,please call immediately urgent message waiting
spam,thesmszone.com lets you send free anonymous and masked messages..im sending this message from there..do you see the potential for abuse???,138,2023-06-29 00:00:00,thesmszonecom let send free anonymous masked messagesim sending message theredo see potential abuse
spam,"WELL DONE! Your 4* Costa Del Sol Holiday or å£5000 await collection. Call 09050090044 Now toClaim. SAE, TCs, POBox334, Stockport, SK38xh, Costå£1.50/pm, Max10mins",162,2023-06-29 01:00:00,well done costa del sol holiday await collection call toclaim sae tc pobox stockport skxh costpm maxmins
ham,Hurt me... Tease me... Make me cry... But in the end of my life when i die plz keep one rose on my grave and say STUPID I MISS U.. HAVE A NICE DAY BSLVYL,153,2023-06-29 02:00:00,hurt tease make cry end life die plz keep one rose grave say stupid miss u nice day bslvyl
ham,"Erm... Woodland avenue somewhere. Do you get the parish magazine, his telephone number will be in there.",104,2023-06-29 03:00:00,erm woodland avenue somewhere get parish magazine telephone number
ham,Are there TA jobs available? Let me know please cos i really need to start working,82,2023-06-29 04:00:00,ta job available let know please co really need start working
ham,Aiyar hard 2 type. U later free then tell me then i call n scold n tell u.,74,2023-06-29 05:00:00,aiyar hard type u later free tell call n scold n tell u
ham,Yup i'm free...,15,2023-06-29 06:00:00,yup im free
ham,"Good good, billy mates all gone. Just been jogging, again! Did enjoy concert?",77,2023-06-29 07:00:00,good good billy mate gone jogging enjoy concert
ham,Yo come over carlos will be here soon,37,2023-06-29 08:00:00,yo come carlos soon
ham,Awww dat is sweet! We can think of something to do he he! Have a nice time tonight ill probably txt u later cos im lonely :( xxx.,129,2023-06-29 09:00:00,awww dat sweet think something nice time tonight ill probably txt u later co im lonely xxx
ham,I guess it is useless calling u 4 something important.,54,2023-06-29 10:00:00,guess useless calling u something important
ham,Ha ha - had popped down to the loo when you hello-ed me. Hello!,63,2023-06-29 11:00:00,ha ha popped loo helloed hello
ham,He dint tell anything. He is angry on me that why you told to abi.,66,2023-06-29 12:00:00,dint tell anything angry told abi
spam,Someone U know has asked our dating service 2 contact you! Cant Guess who? CALL 09058091854 NOW all will be revealed. PO BOX385 M6 6WU,134,2023-06-29 13:00:00,someone u know asked dating service contact cant guess call revealed po box wu
